full_text,label
temenku ahli gizi mbg juga jalan 7 bulan memang buat gaji rapel 3 bulan habis rutin gaji tiap bulan btw posisi ahli gizi imo buat fg terus gaji tara umr jakarta jatim tuh lumayan jadi ambil dulu ,Tata Kelola
propaganda wowo mbg,Politik
trus berita2 buat operasional mbg guna 100 barang import,Politik
makan mbg basi wkwk,Kualitas Pangan
kan grub kak tinggal koordinasi gimana baik anak sekolah lanjut mbg,Tata Kelola
mbg apa kepala ni kok belatung,Kualitas Pangan
padahal paket mbg biar rakyat cuma 10rebu syukur syukur racun,Anggaran
tak aral lintang perintah bakal luncur program cek sehat gratis sekolah ckg sekolah serentak senin hari ini kick-off program ckg sekolah pusat 12 sekolah jumlah daerah program mbg mulai januari 2025 perintah,Sasaran Penerima
dapur sppg polresta bandung sayaga distribusikeun 3 503 porsi mbg sapoe,Distribusi
benar pak mesti mbg buat pilih,Politik
iya jir gue mbg egk pernah habis,Kualitas Pangan
jadi tahu kalau sekolah swasta negeri bonafid mbg tidak,Distribusi
pantau program makan gizi gratis anak butuh khusus ai,Tata Kelola
cepat sembuh dekk kalau kaya gin mbg sekolah bakal stop apa ngga pasa trust issue,Politik
2026 narik utang gede gaban gin 336 triliun buat program makan gratis tepat sasar efektivitas perlu tanya sering bikin orang racun yakin tahun 2027 narik utang lagi,Anggaran
program prioritas presiden prabowo makan gizi gratis sekolah rakyat koperasi merah putih ibarat jalan tol cepat entas miskin bekal masyarakat miskin terampil gizi akses ekonomi program bukan bantu,Politik
tidak biasa makan enak contoh  saran mbg beri sekolah internasional swasta jakarta minimal anak jabat lama satu bulan tangkap kesan mbg kamu rakyat kecil ,Sasaran Penerima
ujung muara mbg ma danantara,Politik
projo main tuduh wae wkwwk percuma elu bacotin soal ijazah jokowi jokowi bilang asli ugm bilang asli punya kuasa mau apa lebih baik cari masalah lain misal mbg,Lainnya
kok baru tahu  mnggaji menteri 100 org d3mi mbg  gji dpr naik paham ,Kualitas Pangan
 sudah henti mbg anak2 sekolah menu makan gizi malah bikin banyak siswa racun henti segera usah malu janji janji lain cuma omon-omon,Kualitas Pangan
kemarin mbg anak mie goreng dong mungkin makan gizi,Kualitas Pangan
mana adik mbg beberapa hari kemarin  kata kedatengan parjo  ngapain datang sekolah,Kualitas Pangan
mbg proyek mubadzir,Kualitas Pangan
sedih sekali kondisi bagaimana mbg tutup semua masalah moga nurani bantu selesai,Politik
anggar daerah potong gila2an program nasional mbg alas efisiensi tiap pemda pusing cari dana jalan roda perintah masing2 salah satu cara naik pbb brutal,Anggaran
buku baris kecipirit mbg blatungnya malah sewot hrsnya berterimakasih kasih tahu,Tata Kelola
iya kan sekarang apa  program jalan mbg mangan orang mangan sing penting ngumpul okeh anak oke rezeki wkwkwkwkkw,Lainnya
kan pajak mbg,Anggaran
bri umkm sinergi maju ekonomi lokal lewat program makan gizi gratis,Ekonomi
memang nutrisi makan gizi but not mbg ,Kualitas Pangan
beberapa kali orangtua kaget lihat makan mbg anak mereka,Distribusi
how come ya biar lihat kerja bos senang nih semua masalah mbg solusi,Politik
pajak kan buat mbg,Anggaran
mbg pak ,Lainnya
fakta mbg makan anyep enak bikin jadi nafsu makan alhasil banyak habis bawa pulang,Kualitas Pangan
padahal mbg lebih baik minta pph yach memank lh mmih egk sayang sama pph byar sjh minta mam sma pph ,Sasaran Penerima
perintah daerah diijinkan naik pajak daerah nya masing2 pati mungkin segera susul daerah2 lain baru pati reaksi paling keras mbg danantara kopdes merah putih wajib evaluasi,Anggaran
bagaimana mo lawan korupsi narkoba kira satu2nya solusi hindar konflik negara tetangga cuma mbg hahay,Politik
kata salah satu murid lebih enak asupan kantin mbg,Kualitas Pangan
bangsa besar mbg batung bilang ini ulah asing kan wok,Kualitas Pangan
ulah antek asing solusi makan gizi gratis ,Politik
makan penjara jepang lebih bersih begizi banding mbg buat anak sekolah,Kualitas Pangan
mbg kelees,Lainnya
mbg gizi pasti makan sehat masa depan bangsa,Lainnya
program mbg jadi bukti nyata kerja keras presiden prabowo lawan lapar,Politik
kan diambilin jatah mbg,Lainnya
makan gizi gizi mana kelola mbg duga masalah dana fantastis rawan gerogot korupsi lihat jelas yaa carut marut mbg ini bangga perintah bohong rakyat mbg hasil,Anggaran
makanya we doomed kalau elit main padahal semua proyek besar longterm even mbg jadi kultur biasa jadi 2x periode cukup latah buat punya program unggul sendiri is killing us,Politik
lupa tengs to mister wowo for his mbg daki sama pragos ssh jangan kasih tau,Politik
kata mah berentiin mbg soal nyusahin bikin masalah aja program aneh dijalanin jadi kan,Politik
mbg luar biasa bahkan orang berani jual apa dapat mitra dapur umum mbg mitra sebut bawah yayasan yayasan bawah bgn jadi kalau tetap untung yayasan,Tata Kelola
tempat kerja mba kalau sekolah2 kab gowa sulawesi selatan alhamdulilah mbg memang rata,Distribusi
serius nanya kemarin terima jadi apatuh awas mbg sppi banyak punya privilege ortunya aparat ya terus oprecnya mirip ramai gitu,Tata Kelola
gin printing money penuh kabinet gemuk mbg seluruh program hedon bangsa besar wkwkwkwk,Anggaran
presiden prabowo target 20 juta terima mbg 17 agustus 2025,Sasaran Penerima
anggota dpr biar cerdas kasih mbg potong uang beras tidur ikn biar hibur wts,Politik
mending kamu hentiin mbg kocak njirr banyak siswa makan mirip adik contoh hari tanya gimana mbg-nya jawab enak akhir makan sama dia cuma ambil susu buah,Kualitas Pangan
ya benar lapor sumber percaya tempo detik kompas joglosemarnews konfirmasi racun massal sragen akibat program makan gizi gratis mbg 11 agustus 2025 korban 196-251 orang siswa guru puskesmas golong diri tenda,Kualitas Pangan
achmad zaini aspirasi masyarakat kunci sukses program makan gizi gratis,Sasaran Penerima
anak orang miskin duit sedia lapang kerja kamu kasih makan gratis lulus sekolah jadi anggur percuma program abal-abal mbg,Sasaran Penerima
males ah mbg fokus daerah sulit ntt daerah batas indonesia timur papua kerja bgn,Lainnya
moga info komen mbg jadi bahan evaluasi jangan gerak track salah,Tata Kelola
bahbhsbhahs korban mbg makan jelas jir coba kalau kelola benar ngotak ak dulu sd swasta makan sekolah sangat senang makan enak,Kualitas Pangan
alam baru awas survei baseline monev mbg daerah sulit it will be my new core memory harap moga manfaat program benar daerah pencil,Distribusi
turut mbg program bagus payung hukum kuat realisasi rawan langgar fiskal dll gaji guru madrasah swasta beda soal langgar uu ketenagakerjaan perintah perlu ubah dekat bantu jadi jamin hak hukum kuat amp anggar afirmatif,Tata Kelola
pikir korupsi jadi nyimpen duit bawah bantal tahu duit hilang hadeuh gagas awal jelas mbg ngejar project fantastik drama politik bukan rakyat anak sekolah hah,Tata Kelola
bocor jurus circle parpol circle elit parjo parcok oligarki mafioso usaha anda kucing anda sekpri lagi mbg danantara sekolah rakyat semua unfaedah,Anggaran
sebut negara pimpin negara mana yabg puji program mbg,Politik
personally rasa memang kaga peduli rakyat soal mbg lihat,Politik
bontang mulai program mbg tahap pertama sasar empat sekolah,Distribusi
hampir tengah buat mbg gilaa,Anggaran
amorim must stay biar ngebuktiin benar sebab terlalu sering gonta ganti latih apa kena teluh anyway balik dpr mbg,Politik
badan gizi nasional bgn menandatangani kerja sama bpjs ketenagakerjaan kerja sama rangka selenggara jamin sosial ketenagakerjaan ekosistem program makan gizi gratis mbg lengkap,Tata Kelola
anggar jumbo mbg hasil cuma cerita basi,Anggaran
tni selalu dukung awal bantu cepat implementasi program strategis hingga seluruh pelosok tanah air program makan gizi gratis rupa fondasi bangun generasi indonesia sehat kuat cerdas,Politik
baru sentuh 2 117 siswa program mbg madiun luas,Sasaran Penerima
manusia pernah bilang anak kurang syukur ngatain pea biasa mbg tambah cerdas anak mau nyicipin nih serius icip dong produk banggan kalian biar kalian rasa nikmat jangan guru dikorbanin,Kualitas Pangan
program mbg baik jadi program rutin penuh gizi anggota dpr dprd kerja keras suara hak usul warga,Politik
mbg vihara gw,Lainnya
 mbg program nasional sangat tahu evaluasi laksana gimana milestone skrg dengar cuma berita racun aja lebih seakan2 kenapa2,Tata Kelola
mbg makan rumah mungkin,Sasaran Penerima
mbg makan belatung gratis,Kualitas Pangan
kalau presiden dengar lapor baik2 saja senang soal mbg siap saja masyarakat terang2an larang anak makan mbg evaluasi lah pak pres program bagus transparansi evaluasi kejar target buruk lah hasil,Tata Kelola
bgn program mbg tambah 373 ribu terima baru pek,Sasaran Penerima
kalau itung2an mungkin ngeratisin sekolah lebih murah dripada kasih mbg,Lainnya
nga beda jauh sama mbg program tipu,Politik
sedia mbg lebih baik wowo,Lainnya
mbg hapus,Politik
kamu ngerti konstitusi duli didik kamu tahu berapa kampus sekolah program didik resmi prabowo soal sehat kamu tahu kalau pkg mbg etc apa lakuin anis lu nothing,Politik
henti mbg pak,Politik
 program mbg anak anak banyak racun turlap benar datang sekolah mbg and guess what makan tahan lebih manusiawi susu gratis tiap hari wkwkwk minggu ,Kualitas Pangan
wkwkwkkw makanya sekarang sasar utama mbg kan orang miskin kak biar kalau gaji telat turun 3 bulan protes suruh sabar aja ato gausah ngeluh,Tata Kelola
sekolah mbg nih kwkwkw,Sasaran Penerima
nggak jatah buat guru biasa jatah siswa masuk makanya makan guru siapa mau makan tambah beberapa dapur sedia mbg terima mbg belum makan makanya mau mau makan makan dibungkusin,Tata Kelola
anak sekolah swasta mungkin kalang tengah tak perlu mbg nah yayasan panti yatim bagaimana warga masyarakat sekolah,Sasaran Penerima
tahun anak sekolah masa pimpin prabowo bagi banyak anak teman sekolah selenggara mbg lihat berita media masuk racun angka 82jt mana,Distribusi
bagaimana asa orangtua anak racun mbg lihat nyata ini,Politik
mbg belakang curiga salah satu konsultan gaya kampanye 02 studying majority of voters behavior amp defining the right method to gain voters,Politik
sama mbg dong baru keren,Kualitas Pangan
jadi sempat napoleon subiantoparte nyerang asean darat sebar semangat liberte egalite fraternite singkat mbg,Lainnya
mbg makan racun genosida yok anak siapa mati sakit silah anak2 pndukung 02,Kualitas Pangan
sri mulyani lebih pilih senang kuasa ketimbang empat sulit ada ekonomi masyarakat ini hrsnya mulyani berani tegur hapus mbg koperasi merah putih sekolah rakyat unggul tegas koruptor amp prilaku kkn tidak,Politik
sedia mbg mau jadi korban,Kualitas Pangan
sama tetap jalan baik anak bangsa lanjut mbg,Distribusi
saksi hidup gimana program mbg rancang amp bikin orang2 keren tuju sangat mulia apa masuk orang politik ambil putus voila program amburadul  cuma jadi bancak,Politik
daerah kabupaten baru uji coba sekali bulan februari sd satu sekolah smp satu sekolah hingga hari sama mbg,Distribusi
dar bendera one piece diseriusin kasus anak racun mbg kaga dipeduliin,Politik
progr rakus anggar terus sedot ratus bahkan ribu t uang rakyat sasar tanya mbg peras merah putih,Anggaran
sok tahu lu kaya cuma kamu makan mewah kalau siswa tuh makan lebih menu mbg minimal amp masak higinis mungkin masak pakai celana,Kualitas Pangan
gambling sangat mau ambil mbg wkkwk jujurly apa sangat coba dulu makan baru kasih anak apa apa sangat sakit sakit ribet ngadepin walmur masalah efek keracunann kan langsung seklai suap langsung garuk garuk huek huek,Kualitas Pangan
mbg nya jalan,Distribusi
adik sekarang pernah mbg,Distribusi
yaa mbg nya benar real hasil nya neymar lah sini mbg racun terus hasil jadi hokky caraka,Kualitas Pangan
every time someone told me nih lowong sppg mbg i was like no thanks mending kerja sesuai ijazah jadi budak wowo bahayain anak,Lainnya
sih anggar besar mbg harus jangan kasih ikn kasih kail kasih rakyat kerja sejahtera tegak hukum adil,Anggaran
gimana pak presiden program bapak mbg koperasi merah putih sekolah rakyat mampu turun anggur besar 0 06 ,Sasaran Penerima
masuk akal prestasi mbg,Sasaran Penerima
makan belatung gratis mbg 2025,Kualitas Pangan
wkwkwk teman kerja mbg keluh pressure-nya gede tepat waktu serba buru anjir nih benar siap matang,Tata Kelola
penuh dilema sekali kak jadi anak terima mbg mana kalau gamo makan suka diomelin guru,Distribusi
menaker yassierli getar rakernas mbg tak cukup kolaborasi total,Tata Kelola
radar jogja - sppg mlati stop produksi tiga sekolah racun mbg sekolah salur,Distribusi
perspektif sehat masyarakat natasya jelas masalah implementasi mbg penuh gizi bersih makan penuh kalori aman makan,Kualitas Pangan
mbg bonus belatung,Kualitas Pangan
sekolah mbg,Distribusi
buat mbg  perlu tambah dana luas terima mbg bismillah staff bangun ,Anggaran
mbg  makan racun gratis,Kualitas Pangan
mbg ambil banyak anggar didik tuh pakai sense,Anggaran
jadi jadi ulang kali si gagas mbg tindak sama sekali,Tata Kelola
benar mbg sasar siapa si ko beberapa sekolah daerah sekarang mbg mbg an,Sasaran Penerima
mbg  makan bareng gweh,Lainnya
umkm maju berkat mbg,Ekonomi
program makan gratis kalau hemat biaya orang kasih makan basi jadi makan gizi malah jadi hazard sehat,Kualitas Pangan
masuk orang tolak mbg kasus racun kalau di-stop dulu lah evaluasi tapi usul sepenuh buruk jaga rantai pasok demand supply imbang biar dikit2 impor apa mbg orang2 langsung mencak2,Kualitas Pangan
persentase duduk brasil cakup program rupa bolsa fam lia 40 juta terima 18 8 dari populasi 213 juta 2025 indonesia 82 9 juta terima mbg populasi 286 juta 29 catat angka brasil dasar klaim verifikasi,Sasaran Penerima
viral makan mbg buang siswa sman 1 cigugur netizen kecam lewat,Kualitas Pangan
wooii ingat sekarang ditny wani piro krn tak gratis klpun racun mis mbg kl sgl sst nya bayar suara burung suara tokek suara merdu si kalau duet namboru,Politik
gakmau marah mau sedih kerja hampir 3 bulan nerima gajih program mbg makan gizi gratis bahkan 5 bln kerja jam 1 malam siang,Tata Kelola
pecah maksud niat urus mbg,Lainnya
kenyang mbg lah buat anak kenyang ndass mu pak,Lainnya
buktiin jangan cuma omon omon 1 tahun bukti apa2 mbg banyak racun makan banyak basi,Politik
mbg makan belatung gratis,Kualitas Pangan
mbg mbg mbg jos,Lainnya
yak salahin siapa voter 2 akwkwkwkwk makan anjing mbg racun  10k bikjn gizi anak kamu cukup monyet ganti pajak swmua kan,Politik
wibisonoys tantang komunikasi memang ada insiden mbg sragen 251 korban jadi momentum reformasi saran libat salur resmi gerindra amp lembaga independen icw dorong prabowo evaluasi ketat hindar korupsi amp risiko rupa suara publik kunci,Politik
reflex plus suka nyata mau coba opsi dua lebih common maxi kaga dateng2 buseet perdana kasih wetfood sheba serta mbg alias strays ipuh otih suka bat moga sehat2 kalian,Sasaran Penerima
uang rakyat bikin bancaan maning son fulgarnya terang terang malu dn ragu mrka maling jamaah uang dana mbg pda hari libur siswa hampir bulan kalikn jumplah terima berapa rts milyart mbib,Anggaran
lama mnjadi ri 1 amp 2 ada kabar baik menyenagkan rakyat mbg kacau investor kosong koruptor vonis ringan pajak naik anggur 19jt miskin intoleran rangkap jabat jual diri usa hutang tambah defisit puja kalau quality preman subur,Politik
dagang makan kecil keluh grgr mbg jual laku bahkan jual jajan jam 10-11 malam mulai keliling jam 5 pagi gila sih,Lainnya
mbg semua ajar tak peduli misal anak jabat kaya bagi,Sasaran Penerima
rupa kamu koyok dapur mbg mohon izin maaf sekali bapak soal kesal sedikit gerak kait sama agama popularitas bodoh rakyat kan harus nyegah dngan stok fresh higienis lalu kece distribusi pakai,Kualitas Pangan
beda kalau warteg makan panas dijuala kalau mbg kan panas langsung bawa sekolah sama makan acara ondangan sama kasus sering jadi racun,Kualitas Pangan
kalau layak mbg nya sih,Kualitas Pangan
tiba makan gizi gratis anjengg,Lainnya
mbg nya gimik,Lainnya
racun program mbg tunjuk gagal awas higiene rantai pasok bahaya anak perintah ketat standar audit vendor prioritas selamat bukan cepat luncur program potensi baik nutrisi eksekusi buruk,Kualitas Pangan
ironi 1 00 dapur mbg konsesi tambang makin jauh nu kaum nahdiyin masyarakat miskin,Politik
kalau perintah naik ppn nutup defisit akibat bengkak anggar proyek ambisius mbg danantara kopdes minta izin dulu rakyat bayar pajak bukan enak naik pajak ppn,Anggaran
mbg singkat makan banyak gula,Kualitas Pangan
lalu biar lalu masalah lama tangan baik jadi lagi lanjut mbg,Tata Kelola
alokasi lain mending support dukung lanjut mbg,Anggaran
ngarepin apa orang sikeras ngambur2in duit apbn buat bunuhin rakyat sndr lewat mbg nurunin tentara buat nganiaya kita kapan kompak bangun kuat wallahi even liat tulis model gin as if harap after several times chaos we had,Politik
berita racun mbg naik kah,Kualitas Pangan
tray ky mbg kirain benar mbg wkwkw,Lainnya
aduh bakal kalah pamor sama sesachet jazzjus mbg kang,Lainnya
mbg utility coin,Lainnya
minggu mood bekal ya mam mbg kantor ,Lainnya
anggar didik total 757 8t  44 6  335t elu acc pakai buat mbg anjeengg,Anggaran
kalau ngapain sulit sulit ribet bikin program mbg cetak buku saku dictionary lengkap 5 juta kata bagi gratis satu kali cetak ikut buku saku logaritma laku tuh buat umur hidup wkwkwk lebih hemat anggar,Politik
sekarang daerah jangkau program,Distribusi
dunia karang lah orang diberitain mana kok anak sekolah racun mbg memang tolol presiden mah lebih tolol rakyat sih tahu program ja pilih,Politik
kak barusan liat berita d tv baru gau kejadianny bengkulu adik ku pulang baru mbg moga aman deh yaallah,Kualitas Pangan
ratus siswa sragen racun usai santap mbg sekolah libur dadak,Kualitas Pangan
tbh harus mbg jangan masuk hitung persentase dana didik jadi 20 alokasi didik maksimal,Anggaran
apa kak malah mbg ,Lainnya
mbg astagfirullah daging ayam matang sempurna sarang salmonella ungkep masak langsung masuk minyak panas api gede asal luar coklat angkat peduli dalam benar matang belum,Kualitas Pangan
mas padahal tinggal googling loh tuju mbg jelas tulis google aneh kamu,Sasaran Penerima
kepala bangun minta anggar makan gizi gratis 2026 tambah jadi rp 335 triliun,Anggaran
bapak inibpernah komen soal racun mbg sih,Kualitas Pangan
makan mbg belatung,Kualitas Pangan
jangan sama gajah sama kartun takut bapak ini padahal latih 5 tahun mlwti krisis covid eknmi mandeg dll nyata urus mbg becus padahal paling mudah sudah pak fokus kerja kerja sprti dahulu jangan pikir 2029 mulu kamu dukung kerja mu,Politik
memang vendor vendor bikin jelek program mbg jadi program tempat cari cuan ditindaklanjuti bangun lanjut mbg,Tata Kelola
vital dapur mbg memang orang profesional bidang biar apa sesuai standar perintah buat orang miskin ahli prioritas beri latih briefing dulu biar paham standar tentu umum kan begini,Tata Kelola
in charge mbg patut pantau,Politik
belanja jor2an didik sehat akses wilayah baik rantai pasok tingkat ekonomi daerah pencil orang diam kali lah buat mbg kopdes mp belanja buat jelas pt vendor nya jabat,Anggaran
kalau liat beberapa postingan mbg memang look-nya kurang enak,Kualitas Pangan
mbg terlalu paksa mending dana alokasi biaya didik lain,Anggaran
kompeten anjirr kompetenn kalau asal masak tahu atur nyimpan makan nutrient campur reaksi gimana terus anak2 muntah2 gimana ngawur cokk bubarin mbg fuckk mending tambah lapang kerja biar ibu bapak beli makan layak,Tata Kelola
mbg - banyak siswa racun solusi  cicip dulu guru - mungkin nanti guru racun wowo nyicipin makan,Kualitas Pangan
dukung masa depan cerah anak indonesia akses makan gizi gratis piring penuh gizi langkah tuju generasi sehat cerdas kuat sama wujud harap lewat peduli nyata,Sasaran Penerima
setan lauk mbg nyh ayam rebus ,Kualitas Pangan
menteri wihaji minta tugas lapang lebih gencar distribusi program mbg 3b via,Sasaran Penerima
mbg makan 83 anggar didik terima manfaat siswa mahasiswa apa arti ,Anggaran
gin ya bantu breakdown 1 poto kasih jelas kait prioritas anggar negara liat prioritas lari mbg tahan pangan militer didik sehat jadi prioritas dua,Anggaran
jadi yaudah kasih sekali semua yekan kekgitu lah pola pikir jabat bangsa besar wkwkwkwkwk nasib klen warga indo dulu jaman si jokowi cabe mahal suruh nanem sendiri beras mahal suruh diet sekarang suruh nanem buat mbg data warga obral hahaha,Politik
mbg  makan gizi gratis mbg  makan belatung gratis,Kualitas Pangan
presiden prabowo target luas terima mbg jangkau hingga 20 juta orang bagi strategi bangun sdm tuju indonesia emas 2045,Sasaran Penerima
ponakan tanya apa mbg kata itu makan siang pagi lah sekolah dia bilang tuh,Distribusi
panjang mbg apa sih  bukan makan busuk gratis-kan ,Kualitas Pangan
oke okok sekarang rengek dasco bowo pecat kepsek tolak siswa mbg,Politik
mau neng daerah bantul sppg tetap wae wira wiri ngeterke mbg cah duh ngeri ora stop sek yaa mengko nek wilayah liane dadi podo siapa sek tanggung jawab,Distribusi
plt kasi smk cabang dinas didik kata pihak dapat lapor kait panggil empat siswa sebut namun pihak pasti sanksi siswa video temu belatung menu makan gizi gratis viral ,Tata Kelola
wah kalau anak cucu larang makan nasi mbg sakit ngeri jijik,Kualitas Pangan
3 ini turut baru sedia satu dapur mbg kota blitar camat sananwetan jelas pilih menu makan laku sembarang tim sppg kerja sama ahli gizi pasti porsi beri sesuai butuh,Kualitas Pangan
wkwkwkwkwk harap apaa sama mbg,Lainnya
kak mau mbg kak aku boros uang,Kualitas Pangan
kurleb sekolah ade mbg bilang makan makan beberapa alat makan bukan foodgrade masalah program mubazir makan,Kualitas Pangan
heboh nampan mbg kandung minyak babi perintah buka suara lengkap gt gt gt,Kualitas Pangan
mau protes panggil guru kalau protes racun mbg m nya mbal-mbul,Kualitas Pangan
kakk adekku makan mbg cerita samping tahu belatung ayam nya banyak darah sama bau sangat,Kualitas Pangan
mbg mall banteng galeria aka bringkit,Lainnya
wok kamu henti sj mbg jelas ini kamu lama mirip jokowi bohong kerja kamu,Politik
berita kompas keluarga masuk orangtua murid makan mbg bawa pulang kena duga racun total 196 orang semua pulih rawat inap untung parah,Kualitas Pangan
great job  sekarang fokus perintah pusat program mbg koperasi desa political will perintah nampak buat tuju arah sana ,Politik
kalau produk loka cuan beda produk impor cuannya  gede usaha protes impor food tray mbg produksi asosiasi produsen wadah makan indonesia apmaki tegas industri negeri mampu penuh butuh food tray,Ekonomi
liat noh ikn mbg apa rugi negara ,Anggaran
dana didik triliun habis buat mbg b,Anggaran
program makan gizi gratis inisiatif presiden prabowo tingkat sejahtera masyarakat lalu kuat gizi anak sekaligus dorong peetumbuhan ekonomi cipta lapang kerja,Ekonomi
coba sekal tukar menu jabat negara makan nasi jatah mbg terus siswa ganti makan menu makan siang jabat,Politik
nyata mbg kata makan gizi nyata gizi ya ,Kualitas Pangan
ngentott coba anak kamu kasih mbg racun biasa,Kualitas Pangan
keren fyi tadi mbg susu,Kualitas Pangan
mbg makan belatung gratis,Kualitas Pangan
sekolah rakyat mbg koperasi merah putih all of those are akal perintah buat korupsi,Politik
video sempurna program mbg perintah bakal pakai sistem hybrid,Tata Kelola
dulu bayang gerak umkm daerah mirip sistem beri makan kaum lemah d banyuwangi tp mbg sistem bayar per 3 bulan sekali umkm mana kuat ujung2ny main modal gede,Anggaran
sama karakteristik perut alergi biasa juta anak,Kualitas Pangan
mau minggu mbg terus traynya food grade allahu akbar perintah kerja apa sihh,Kualitas Pangan
tetangga pilih wowo datang rumah beberapa kali ngeluh soal sama mbg ,Politik
masalah lapang kerja itu bangun kan buka banyak lapang kerja mau jadi sppg program ini bayar bulan nya lanjut mbg,Ekonomi
data kamu tahu hingga akhir 2025 berapa t uang kucur perintah biaya mbg,Anggaran
makan siang gratis mbg biaya apbn rupa dapat hasil pajak dll baik politik eh nama ganti bukan dagang sapi lagi,Politik
makin kesini mbg makin buat degub jantung makin kenceng,Kualitas Pangan
makin aneh bijak ini nama anggar didik hampir stengahnya cuma mbg,Anggaran
mbg jadi bentuk bansos bentuk barang baik beri makan rakyat sembari naik taraf hidup kerja rakyat buka bagai dapur input output everybody wins begitu lama basic systemnya benah sama,Ekonomi
komisi ix dpr beri catat usul anggar rp335 triliun program mbg,Anggaran
temu data spesifik kena total hutang program makan gizi gratis mbg vendor seluruh indonesia per 30 juni 2025 anggar mbg tahun 2025 besar rp71 triliun lapor resmi sebut rincian utang mungkin wajib finansial,Anggaran
geger ratus siswa guru golong sragen racun masal program makan gizi gratis mbg -,Kualitas Pangan
pas konser bukan diem-diem yushi mana semangat program mbg tuh apa,Politik
tuju purworejo kenyang langkah awal ramai pasar2 tradisonal tempat banyak orang cari makan saat mbg masuk seluruh daerah rakyat cerdas pintar produktif,Distribusi
sesuai tarif wakakakak mbg tuh buang,Anggaran
nih akun pernah kritis soal mbg pati pajak yah nih akun cuma promosiin prabowo jokowi kedok sarkas dari awal ampe akhir konten nya hidup jokowi konten kritik kaya demo pajak cekik,Politik
izin tanya pih first dayy lapas kasih mbg gk,Lainnya
siap siap pajak segala arah mau harap nol defisit mbg tetap jalan makan banyak anggar wkwk k l minta anggar berapa susah efisiensi,Anggaran
indonesia mirip wanokuni kenyang jabat aja padahal sda limpah rakyat racun mbg banyak lapar susah cari kerja miskin,Politik
ya nyata prabowo bagi benar program bolsa fam lia brasil butuh 10-11 tahun capai 40-50 juta terima sejak 2003 ri target mbg 82 9 juta tahun 2025 ambisius hingga juli 2025 baru capai 5 juta target 20 juta agustus,Politik
program makan gizi gratis langkah strategis cipta generasi unggul sehat dukung penuh inisiatif masa depan anak indonesia lebih cerah daya saing global sama wujud indonesia emas 2045,Sasaran Penerima
bahan makan sunat sana-sini akhir didpt bahan makan super murah hampir busuk amp kedaluarsa proses masa simpan amp distribusi asal banyak anggar korup hasil mbg ajar jadi makan layak konsumsi,Anggaran
