full_text,label
sama deddy tolol pas bahas kasus mbg jangan over glorify,Politik
didik gratis amanah konstitusi janji mbg dar janji perintah beda buat skala prioritas dua tak bisa cuan,Politik
gubernur ntt emanuel melkiades laka lena tekan penting evaluasi cepat program makan gizi gratis mbg jalan jumlah wilayah ntt,Tata Kelola
anies ganjar punya program butuh biaya sangat besar waktu singkat outcome kalau ada baru dapat jangka panjang mbg koperasi desa,Anggaran
nah ini baru makan gizi gratis ya ,Kualitas Pangan
sama tni badan gizi nasional bgn menteri tahan aktif tinjau kesiap dapur mbg dari daerah pencil hingga sekolah layan masyarakat akar rumput,Tata Kelola
makan belatung gratsi a k a mbg,Kualitas Pangan
anggar mbg 71 triliun rencana tambah tambah tak 100t usul awal tengah jadi 121t tahun depan usul anggar bakal lebih tinggi lagi jadi program perintah anggar besar,Anggaran
coba anak buah d kasih mbg pak biar prestasi tingkat jd bikin puasing pak,Sasaran Penerima
masalah ijazah nadiem masalah kurikulum sama chromebook lanjut ikn masalah mbg undang undang beres beres akun rekening bank 3 bulan aktif sita tanah garap sita sambala sambala sambal lado sambo bolot minyak goreng oplos beras oplos,Politik
setitihik keringahat psk pelanggannyaha jadi mbg anahak2 sekolah,Politik
menu gabeda jauh sama berkat padahal mbg selalu nasi,Kualitas Pangan
mbg wkwkwk,Lainnya
program mbg benar evaluasi akhir taun gitu lakuin monev layak lanjut tahun ikut kayak bukan memang mau jujur yaa,Tata Kelola
cara korupsi legal nih tanya ya apa jamin vendor2 mbg kasih kick-back pihak punya wewenang atas cair dana ini ayo coba jawab,Tata Kelola
moga sekolah adik tolak mbg,Lainnya
henti lah mbg,Politik
guys mau tanya deh buat kalian guru jujur senang si sama mbg,Kualitas Pangan
mbg hari spam protein huek huek,Kualitas Pangan
tuhan memang info valid serius benar ini mah  waullahi hamba rela lahir batin seluruh mang penting mbg hisab hukum lebih cepat dunia dp lunas akhirat we as citizen are israeled astaghfirullah,Kualitas Pangan
lanjut mbg program aneh itu pinta satu,Politik
anak sekolah ajar perut kosong program makan gizi gratis hadir solusi,Sasaran Penerima
menteri uang sri mulyani umum alokasi anggar didik 2026 rapbn capai rp757 8 triliun jumlah itu rp335 triliun 44 persen alokasi program makan gizi gratis mbg,Anggaran
pak gak usah racun mbg,Kualitas Pangan
sepupu tiap hari jemput finally mbg makan habis food waste anjay,Kualitas Pangan
tuju syarat mbg memang cenderung untung korporasi besar cpin japfa bukan umkm transfer langsung orang tua lebih efektif tingkat gizi keluarga via pilih lokal kurang korupsi pasok dorong umkm butuh awas dana tepat sasar,Tata Kelola
terus guna sppi apa jadi mandor kerja dapur mbg,Tata Kelola
gizi anak makin jamin program mbg,Sasaran Penerima
food poisoning sama maggot keitung gizi mbak coba makan mbg full 30 hari sana kalau food poisoning hebat,Kualitas Pangan
wkwkw lucu sekali mbg kalau kenan buat makan bawa pulang biar kena lapor sedia limbah makan kalau bener-bener mau jatah hak nya kasih orang ,Tata Kelola
mbg dong,Lainnya
tetangga punya anak2 usia sekolh rata2 pda mau makan menu mbg nya bawa pulng pas ngicip tampil yakin benar masakanya benar hambar terus dstop sih brkali2 anak2 pda racun terus mbg tuh kayak efisien,Kualitas Pangan
so sad  masa dana mbg gede banding buat didik,Anggaran
jadi jelas jelas atas  stop proyek mbg rakyat indonesia bukan kelinci coba,Politik
buat tambah anggar mbg,Anggaran
resmi belum sop sosialisasi semua wilayah s d april 2026 ahli gizi bagi2 mbg gizi sesuai sop bocor aja nilai sempet edar benar bahan baku saja jadi berapa biaya kalau kelola pihak3,Tata Kelola
hubung apa  wong sudah proyek mbg bagi daging sapi susu 10rb porsi mau apaa ,Kualitas Pangan
ok kasi makan anak kamu mbg skrg,Lainnya
seengaknya mbg uang nya buat lebih oke kaya didik dll kerja teman semua kena phk apa uu cipta kerja kalau 01 03 pilih uu kata bakal hapus banyak kebijakan2 kurang pas usah apa apa,Politik
ngeri uang banyak mbg pegang badan gizi,Anggaran
  jadi marketing tawar langsung calon sedia tempat mbg - lihat  program bagus  semua wilayah manfaat nya,Distribusi
mbg maksud lo wwkwkwkw,Lainnya
pak maaf percaya dongeng bapak pilih 02 ikut banyak kerja proyek ikut keluarga bapak hobby bilang bocor sinergi sebab bocor itu mbg bocor dahsyat pak rakyat suruh makan sampah gratis,Kualitas Pangan
arti makan mbg belatung dong,Kualitas Pangan
arti kalau mbg nya ikan makan dulu soal malam makan ikan lengan alergi gatal langsung jir,Kualitas Pangan
ditepatin cuma ini mbg walaupun racun,Kualitas Pangan
anggar program makan gizi gratis minta tambah dana 50 trilyun  jabat memang gila mau nyolong malu nya rakus nya ketulungan persis kek babi minta duit trilyunan kek minta duit gocenk bwat parkir,Anggaran
racun mbg guru minta nyicip jadi pula benar racun buah program mbg blackhole salah internal sibuk salah pihak luar terus seret henti,Kualitas Pangan
mbg token by,Lainnya
atur siswa sedia datang libur jatah mbg tanya mana jatah mbg siswa segan datang masa mau digares semua tugas,Distribusi
banyak menteri badan lembaga efisien anggar buat dukman jadi bengkak efisiensi inpres kemarin harus layan publik bangun malah habis buat dukung manajemen jumlah k l bengkak mbg ikn tumbuh ekonomi seret,Anggaran
libur tetap mbg ujung2nya buat makanin unggas,Distribusi
mau bukti apa insentif bsu kamu kira darimana project mbg darimana kata kamu ngurusin anak tetangga kamu makan siang gratis tetangga kamu under umr mungkin bsu bahas project food estate dll gilir mirip pura2 tutup kuping,Politik
dana bansos mending guna tepat sasar misal mbg salah sasar pakai judol dana teroris tepat bilang bang,Anggaran
giat oknum mubazir impor pesawat mbg fasilitas diri bancak hasil bumn serakah lalu utang amp naik pajak tak fasilitas sejahtera usaha ekonomi amp bantu warga miskin beri teladan jalan tuju negara uudri 1945 jiwa pancasila pedoman bangun bangsa ri,Politik
mbg bukan cuma soal gizi soal aman nyaman,Kualitas Pangan
keren tidak ribut beranta kalau mbg rencana 2025 kemudian tetap anggar nya apbn 26 dst tahap adil tara jangan ngasal sd damping murid sd-a makan gratis murid sd-b tonton ngiri,Tata Kelola
mungkin masuk giat mbg,Lainnya
guru ngurusin mbg 1 jam ajar hari capai sekali tambah kerja,Tata Kelola
yaallah yaallah moga sekolah jadi mbg mending makan bakso muntah mbg,Kualitas Pangan
mencret anjay mrka tahu kualitas mbg dbwh standar makan 1x muntah2 aplg 1bulan surup,Kualitas Pangan
and yesterday someone said mbg tingkat mampu bahasa inggris siswa,Lainnya
tuju sih mbg khusus subsidi bantu daerah memang kurang gizi,Sasaran Penerima
makan kan laku anak anak liburr sekolah kalau anak anak masuk biasa bangun beri makan siap santap lanjut mbg,Distribusi
pihak kurang tuju mbg jadi prioritas nasional mbg penting bukan prioritas komen kamu tolol 82jt terima ratus ribu titik kamu nilai gagal 1 2 berita racun contoh logical fallacy,Kualitas Pangan
duit buat sukses program mbg biaya gaji dpr naik tri bejibun hobi wowo belanja alutsista,Anggaran
mayoritas sekolah sentuh mbg jangan suka main klaimtanpa fakta,Distribusi
memang program mbg tahap kak moga tahun lanjar mulai jallan kak lanjut mbg,Distribusi
coba kasih tahu  50 dana didik mbg bocor bgn lawak benar wkwkwkwkw,Anggaran
bhabinkamtibmas salur makan gizi gratis mbg siswa sekolah pasti anak,Distribusi
mbg ganti susu pakai kopi biar pintar amp mata ngejreng buat ajar,Kualitas Pangan
lah kok siswa panggil bikin mbg belatung lah panggil aneh sangat memang negara astaga,Tata Kelola
coba hitung berapa belatung temu mbg,Kualitas Pangan
program mbg cipta banyak lapang kerja baru semua kalang,Ekonomi
kemarin bilang mbg tingkat prestasi nilai sekarang tingkat hadir siswa hihihi,Sasaran Penerima
dulu mbg banyak sangat komen2 asbun jabat minum susu 2 liter lah ulat jadi menu mbg lah padahal kalau memang bagus coba kasi anak cucu kalian dulu ulat susu 2 liter itu berani  wahai jabat,Kualitas Pangan
datang cek kelas makan siang bareng bocil jagain program mbg endingnya seskab teddy angkat jadi duta sekolah rakyat  keren memang nih seskab,Politik
iya keponakan sd  trauma kasih mbg ayam nya bau ,Kualitas Pangan
halah mbg mbg dapetnya sukro sama beras gizi sekali tuh,Kualitas Pangan
jangan asal ngomong nyinyir mending dukung lanjut mbg,Distribusi
stop mbg duit alih ntuk buka lapker,Anggaran
mbg benar efektif jadi ladang korupsi aja sayang sangat pas masa kampanye tel mentah mentah sama ibu ibu senang dengar anak ny mbg sekolah,Kualitas Pangan
mbg  makan racun gratis,Kualitas Pangan
betul bgt mbg program bagus sangat jangan cuma orang dongo bilang bagus salah bukan bijak laksana terlalu tegesa2 alhasil nyusahin sana sini,Tata Kelola
ribu siswa duga racun makan gizi gratis pakar gizi program baik henti waktu,Kualitas Pangan
halah bcd orang2 kantin sama dagang keliling tiap hari sambat laku grgr mbg wowok mana peduli begitu,Ekonomi
mind you memang atur sana viralin mbg ,Tata Kelola
tepat hut ke-80 ri bangun kejar target 24 juta terima manfaat program mbg,Sasaran Penerima
ada mbg kok,Distribusi
camat saya anak2 mau makan menu nasi minta mie spageti roti kalau menu nasi sisa makan banyak banget berkarung2 makan makan 400 terima mbg kec,Sasaran Penerima
racun mbg 1- 2 okt 2024 nganjuk 2- 13 jan 2025nunukan selatan 3- 16 jan 2025sukoharjo 4- 19 jan 2025 pandeglang 5- 18 feb 2025 sumba timur amp empat lawang 6- 25 feb 2025 kubu raya 7- 26 feb 2025 takalar 8- 14 apr 2025 batang 9- 21 apr 2025 cianjur 10- 23 apr 2025,Kualitas Pangan
kalau benar cerita baik mbg stop tuan presiden,Kualitas Pangan
bang ambil alih mbg indo bang,Politik
jangan kak henti kan semua anak sekolah dapat rasa mbg utama diplosok lanjut mbg,Distribusi
salah sih anggur turun mbg salah satu faktor kan kerja dapur ahli gizi tukang distribusi semua manusia juga bukan robot,Ekonomi
benar baik mbg hapus banyak bakal tuju anak mati racun takut perintah semua partai asai harus lawan politik bakal nyerang kait henti mbg,Kualitas Pangan
ko sekolah seh sekolah tahu apa2erela terima mbg kan kelola langsung mbg pusat kamu tahu sekarang badan intansi negra urus mbg hadehh,Tata Kelola
mbg belatung tuh gimana maksud negara skandal besar loh kok mikir positif bahaya buat anak mirip mas kamu punya akal kan mas,Kualitas Pangan
ngapain dulu omong impor susu penuh mbg memriotaskan hasil rakyat dukung ekonomi kapitalistik,Ekonomi
program mbg tetap jalan lama libur sekolah sedia paket siap santap kemas program makan gizi gratis mbg tetap langsung lama masa libur sekolah badan gizi nasional bgn siap skema distribusi paket makan lama masa libur,Distribusi
saat evaluasi cukup trialnya mbg beri anak2 benar butuh jumlah terima kurang anggar per porsi naik jadi benar gizi racun makan kendali,Sasaran Penerima
mbg menjaji rintis hilir pangan lokal desa,Ekonomi
racun mbg kupang sppg sanksi data aman pangan keluar,Kualitas Pangan
gimana kalau tiap rapat jabat makan ala mbg makan enak kan harus mau dong,Kualitas Pangan
ritwit 100x huft depan sma dapur mbg januari ampe sekarang kaga jadi jadi vv,Distribusi
ya kasus racun mbg memang banyak lapor sejak januari 2025 kupang 140 siswa daerah lain total ribu korban bbc tempo tunjuk lemah monitoring awal perintah sedang evaluasi dpr butuh awas ketat hulu,Kualitas Pangan
mbg apa daerah pertama itu sklah mlh suruh bawa makan sendiri terus foto,Distribusi
program mbg kamu bikin bocorr genduutt,Anggaran
apa nunggu tinggal dulu baru mbg henti pak kaji ulang program,Kualitas Pangan
fokus program makan gizi gratis ai kurang tepat efektif ini cuma akhir septik tank,Tata Kelola
keinget temenku ig tenang bapak program mbg usaha anjay padahal cuma volunteer,Lainnya
luar kendali perintah kerja bareng mitra lt kalau cost tinggi pakai kerja kalau cost ga punya pilih  mau kerja gaji kecil  mau  luar mau kerja gt alamat reimburse dapur mbg makin kecil,Tata Kelola
sini sekolah nya si cadut mbg,Distribusi
wow memang lama 10 bulan perintah anak miskin angkat anggur atas pajak makin cekik ulang kali mbg racun bahkan ambalat paruh hilang saya tetap hormat pak  cuman sedih,Politik
sop mbg susun amp asupan gizi sesuai hak kelola sit kck akhir bangun dkepalai bukan ahli bid gizi buat statement konyol kelola lalu pihak ke3 kena pajak punya margin kalau pungli,Tata Kelola
jauh lebih enak mbg 5 sehat kamu sempurna,Kualitas Pangan
sequel maomao kerja nyicipin mbg bom dibagiin,Kualitas Pangan
nih mbg menu burger rakit dulu mana daging ganti telur yg tandain seperti mau bikin scramble egg jujur enak bgtt tuh seperti biar penuh bagi kotak2nya jadi dipisah2 gitu,Kualitas Pangan
mbg makin ngawur menu somay kata mah stop nih program buang anggar,Kualitas Pangan
si wamen didik stecu suru makan mbg kalau racun kalau tambah pintar alhamdulillah,Kualitas Pangan
wamen ingat sukses besar contoh mbg negara tetangga sana pelaksanaanya kendala laksana benah diri wamen cuma komentar baik aja optimis donk,Politik
program mbg ngebuka lapang kerja ibu banyak kok manfaat nya lanjut mbg,Ekonomi
penting dana korup mbg nya bagus kurikulum tepat target cerdas anak capai peringkat atas saing negara maju guru sejahtera,Anggaran
anggar didik 20 persen rancang undang anggar dapat belanja negara 2026 naik hampir paruh alokasi anggar makan gizi gratis mbg bijak langusng tuai kritik tengah implementasi mbg nilai,Anggaran
udahin lah jadi ngabis2in apbn aja sekolah anak gw mbg jarang makan kalau rasa enak makan rada2 basi dll hampir tiap hari kaya gitu,Kualitas Pangan
kasihan sangat jadi guru gaji rendah suruh cobain makan program mbg racun kena guru duluan,Kualitas Pangan
banyak kok lapang kerja buka semenjak ada program ini bangun buka lapang kerja sppg layan program lanjut mbg,Ekonomi
mbg benar2 bingung sekarang 30 ribu anak muda iming2 jadi asn bgn mudah buat mecat didik 3 bulan d barak penuh juang itu pasti hak wajib penuh semua,Tata Kelola
hah mana kalau tempat sih libur stop mbg tau gitu,Distribusi
bilang kan mbg usah dilanjutin ,Lainnya
bayangin orangtua tiap pagi baca berita racun mbg lalu sadar siang anak2 makan program yag sama,Kualitas Pangan
siswa2 malaysia papua new guinia mbg lebih pintar bahasa inggris,Politik
apbn defisit akibat program mbg korupsi masif waris hutang rakyat peras lalu pajak tambal defisit ini kl wowo lamban tindak otw indonesia bubar,Anggaran
minim kontraksi otak kamu yaa mau elu s 3 kek perlu ribet cuma baca narasi elu wall mirip jaga wc senin mbg banyak korban nya dicobain anak ring 1 fair kok repot sih ruk,Kualitas Pangan
wkk ke 4 siswa memang salah sih bocor rahasia negara mbg  makan belatung gratis ,Kualitas Pangan
orang halu kok jadi tri uang pak tan dana sedot danantara mbg kabinet gendut  lama banyak impor produk tani bahan baku nya cukup buat butuh domestik,Anggaran
efek mbg tuh kan netanyahu kena efek makan gizi gratis basi,Kualitas Pangan
pakai jamin apa  proses dapat proyek mbg korup maksud korupsi korupsi jalan sistematis ,Tata Kelola
moga gadikasih jobdesk tester mbg,Kualitas Pangan
nongkrong fore dengar penyepong mbg,Lainnya
rakyat bohongin terus mbg baru tahun siswa racun om wo,Politik
benar serius nanya memang mau ngapain kalau d indo uangkap kasus gitu apa orang racun mbg biasa cuma 0 001 ini halah 0 001 cuma buat data saja ,Kualitas Pangan
menteri umkm lanjut komitmen libat usaha mikro mbg momen penting buat ekonomi rakyat naik kelas,Ekonomi
siswa masuk program mbg sini santap makan tonton video atas,Lainnya
parah bgt mbg kasus bejibun maksa buat diterusin,Kualitas Pangan
makan mbg,Lainnya
mbg berapa besar dampak buat didik,Sasaran Penerima
gubernur bobby tegas siap dukung program mbg kmp sr sumut,Politik
makan belatung gratis banyak ye panjang mbg nyata wkwk,Kualitas Pangan
asal kayu agung kabupaten ogan komering ilir sumsel kenal suplai ikan dagang pasar kayu agung usaha mulai 2015 awal beberapa kenal profesi tani ikan,Ekonomi
mending bapak soto bio urus mbg,Lainnya
kalau political will tiba tiba ngatur 300t buat mbg danantara hopefully someday political will supportif sama didik hari capai liat dosen guru ngeluh nyerah,Anggaran
jelas program lanjut mbg fokus ikan mbg anak sekolah ibu hamil,Sasaran Penerima
hired orang  cerdas bikin link apa mbg  sambung sambungin  cocokoligi link narasi maksud tuju ahh blunder sendiri,Politik
lama beri program mbg siswa lokasi itu amat anak tunjuk selera makan baik hidang saji al haris sebut makan sebut tampak sehat bersih penuh standar gizi harap,Kualitas Pangan
pernah dengar dapur mbg malah,Distribusi
jadi mimpi anak jadi juara kelas gara-gara mbg coba pastiin menu cukup gizi belum cuma sekadar program bagi makan biar lihat keren,Kualitas Pangan
program mbg kuat tahan pangan lokal lalu dapur sehat kota banjar,Ekonomi
mbg bro,Lainnya
kepala bangun respons keluh mitra dapur mbg tolak sistem verifikasi,Tata Kelola
waktu jadwal bagi mbg dengar lagu2 inggris mungkin tingkat minat ajar krungu terus penasaran arti lyrics nya terus cari arti opo umpomo gurune koyok guru tk anak2 sekarang makan wortel wortel bahasa inggris nya carrot,Lainnya
iya banget mana mbg makin hari makin busuk ,Kualitas Pangan
buah menu makan gizi gratis tempat tempat kamu apa buah,Kualitas Pangan
nkri harga mati indonesia emas 2045 legal ruu tni mbg semua sekolah hidup prabowo ijazah jokowi asli cinta indonesia indonesia tanah rizzler sigma pusaka abadi fanum tax indonesia sejak dulu alpha selalu puja puja gyatt,Politik
mbg versi serius bener lebih fresh lihat manfaat mbg versi prabowo bikin heboh nir manfaat,Politik
satgas pamtas ri-rdtl pos aplal tanam nilai nasionalisme cek lokasi program makan gizi sd kecil banu,Distribusi
kalau siswa nulis sama baca salah guru kalau siswa prestasi gara2 mbg pak nyata nya sekolah banyak makan mbg nya gizi ayam guru nya pak,Politik
kalau pak prabowo sering jalan lorong sering loncat gorong gorong tahu semua nyata kurang baik banyak masalah mbg lapang,Kualitas Pangan
mana program mbg harus keluarga bukan orang2 mampu,Sasaran Penerima
ka sini rasa bagi mbg lho tanya bocah sd-sma hehe,Distribusi
cara tambah anggar mbg tambah gaji jabat naik tarif pajak gila2an rakyat timbul tenggelam sama rakyat hiidooeepp jhoo khoo weeii ,Politik
frfr ayo dong ditindaklanjuti kocak negara gajelas mbg panganane yo makin gajelas etc etc,Kualitas Pangan
mbg rata gtuu bentuk,Distribusi
mbg mizi,Lainnya
biasa sisa mbg mubazir bagi kan total hadir siswa 1 sekolah mungkin 100 hadir,Kualitas Pangan
selamat siang pak presiden ijin mbg wajib evaluasi giat dapur mbg mulai jam 12 malam bagaimana basi usul kami alangkah baik kelola masing-masing sekolah sangat kontrol hasil lebih maksimal,Tata Kelola
kalau mbg sinergi sekolah rakyat efek lap gizi  literasi,Lainnya
mungkin dpr perlu jatah mbg biar tingkat konsentrasi bahas butuh dekat matematika bahasa inggris yaa sekali uji toksisitas makan kasi murid2 khan,Kualitas Pangan
program omong sama mbg walaupun tak tahan lama dar saat penting laksana,Politik
berita sebar benci pak prabowo - 251 korban racun banding 15 juta terima mbg 99 99 orang racun arti program 99 99 sukses warjarlaah program presiden bukan progam tuhan -- bismillah tri terang,Politik
tuju stunting memang domain utama kemenkes cegah medis nutrisi mbg meski bawah koordinasi pmk kemendikbud integrasi upaya overlap sinergi jelas hindar boros apbn ide bagus efisiensi sumber antara unicef,Politik
perintah tuh beranta mah yaudah beranta sono usah ngacak hidup rakyat sonony beranta anj mah lampias sma tempat cari hibur cuma x sma tiktok mau diobrak-abrik heran kayak ad kerja aj urusin mbg sma ijazah jokowi dulu mending,Politik
mbg proyek gagal negara terlalu paksa meski jalan serentak beri manfaat masyarakat nyata,Tata Kelola
bagus kalau lanjut mbg meski libur anak benar perhati gizi,Distribusi
coba tuan tri makan siang pakai mbg sama sama rakyat,Kualitas Pangan
sejak mbg tambah tugas tanggung jawab ibu bapak guru  bilang menkeu beban negara  ,Tata Kelola
banyak phk  murid racun mbg korupsi bumn  solusi cukup  sorry ye ,Politik
usut siswa smpn 8 racun mbg gubernur ntt melki laka lena bentuk tim investigasi,Kualitas Pangan
kalau better sih paling main aman gabakal lebih jelek mbg danantara and shits what wowo do now,Lainnya
kerja anggap kurang penting anggar mbg 8 ribu korupsi 200 jadi racun mana,Anggaran
wah mas samhugget benar mbg akeh kasus racun massal sejak jan 2025 kaya ing cianjur lan bogor  kudu evaluasi ketat kdmp anyar diluncurke 21 juli tujuane nguatke ekonomi desa durung kontroversi gedhe nanging menteri judol kaya budi arie benar ana skandal nek negoro,Lainnya
main sosmed kena pajak cari dana buat mbg wkwk,Anggaran
mbg taek,Kualitas Pangan
wow bisa rata seluruh anak anak indonesia engak za apa kota besar sorot media saja di jombang tahun 2025 mbg trial di ntt saja masih banyak betul stunting saya lihat mata kepala sendiri miris apakah indonesia,Distribusi
kamu kalau suruh makan mbg paling mau,Kualitas Pangan
batal mbg pak sayang duit buat baik kwalitas prndidikan mnyediakan alat2 latih skill kerja kayak china,Anggaran
mbg  menghayal sama gerindra,Politik
salam indonesia raya usai kunjung kerja bal beberapa waktu lalu bapak presiden prabowo subianto titip pesan ketua dpd gerindra bal bapak made muliawan arya alias deh gadjah mulai masalah sampah makan gizi gratis hingga kasus perbekel baturiti tbn,Politik
tampak sih bgitu buruk apa progtam mbg tetap tahan perintah bukan sangkut reputasi sj lain mgkin untung beberapa pihak mgkin mrp cita2 besar prabowo anggap mbg program bangga,Politik
251 siswa racun menu mbg bupati sragen turun tangan,Kualitas Pangan
dukung program mbg ,Sasaran Penerima
dampak kembang makan gizi gratis tani lokal tani daerah sekolah tempat anak anak sekolah guna apa apa minta program sebut bahan bahan makan lah target presiden prabowo,Ekonomi
nguaworr cik kasih mbg mampus,Lainnya
apa sih duit beli secrom ayank ongkos pergi briefing kantor sama dapur mbg nnt mari sabar ayank langsung hidup kepala ledak sedikit gaoaoa,Lainnya
makan gizi gratis salah satu gagal diet sisa banyak sangat anak2 picky eater,Lainnya
baru 10 ribu siswa padang nikmat mbg dalih pemkot,Sasaran Penerima
jangan ajg adik racun mbg,Lainnya
ijin pak tum bukan arti silah pak jokowi jalan depan pak prabowo benar program mbg habis bakar duit ratus trilyun niat baik kalau cara salah tetap tegur pak tum,Anggaran
kasihan sangat yaa mbg habis banyak seluruh bahkan tiap hari,Distribusi
judol i sleep mbg kacau balau i sleep jabat rangkap jabat i sleep banyak anggur i sleep miskin i sleep intervensi asing i sleep corrupted law i sleep masalah didik i sleep pajak everywhere i sleep pasang bendera one piece real shit,Politik
serma amir damping makan gizi gratis sdn 10 bone serma amir babinsa lurah bone kodim 1421 pangkep laksana damping giat makan gizi gratis siswa-siswi sdn 10 bone lurah bone camat segeri kabupaten pangkep,Distribusi
riil cuii mbg  smile fruit,Lainnya
dah tinggal nunggu pekan budaya pati senayan itu kalau rakyat kompak sayang rakyat maaf usah kenyang kasih makan mbg langsung diam,Politik
kalau kasus racun mbg konsekuensi hukum pak kereenn perintah mu pak kalau tahu korupsi lalu kembali hasil korupsi nya tahu konsekuensi hukum pak kereenn kamu sama rakyat bicara hukum gagah pak,Politik
duit kepake buat mbg sih,Anggaran
bocah si seneng2 kak cin esensi mbg dijanjiin manaa mah gulaa,Lainnya
sabang merauke program makan gizi gratis pasti anak kurang gizi,Sasaran Penerima
junjung kamu lebih parah juta t hemat potong anggar k l lain hasil mbg b nya racun,Politik
benar sekali jadi perhati internasional anak indonesia racun masuk berita jepang bukan prestasi mbg racun mbg gizi nggak racun iya,Kualitas Pangan
mbg tolol sih ngabisin anggar,Anggaran
mbg anak2 makan malah lebih gizi itu,Sasaran Penerima
data hasil teliti nyata prestasi siswa tingkat dar omon amp klaim pihak kalau tingkat peristiwa siswa racun mbg fakta,Kualitas Pangan
dunia internasional apresiasi program makan gizi gratis,Politik
satlantas bantu distribusi 12 648 paket makan gizi gratis siswa aceh tengah lewat,Distribusi
makan mbg,Lainnya
tuh pbb pusat peduli kah minimal tegur kalau memang sesuai atur pusat sr tengah banyak sekolah bahkan murid baru mbg program nya bagus kok realiasasinya betul penuh gizi fasilitas didik sdmnya dulu tingkat,Distribusi
mana pajak pakai buat mbg,Anggaran
ini mbg penting luar sana banyak anak2 sekolah dapat fasilitas sehat baik,Sasaran Penerima
apa nama tutup sedih depan publik sekarang depan lu ayo makan mbg nya biar naik 10kg ,Lainnya
nyata sekolah keponakan mbg,Distribusi
anggar pilkada 38 triliun anggar mbg 171 triliun anggar ikn 2025-2029 40 triliun simpul prabowo pilkada mahal,Anggaran
eh tolol prabowo jabat 4 tahun lebih lagi waktu penuh sisa janji tunda sekarang janji2 mbg sejahtera guru nasib tani sekolah rakyat swasembada beras berantas korupsi realisasi,Politik
makan gizi gratis masa depan anak jadi jamin,Sasaran Penerima
dana mbg satu dana didik alokasi dana didik mesti paling besar mau bangsa maju kuliah gratis gaji guru amp dosen naik tunjang perhati riset2 kampus dana cukup sdm kualitas bangsa maju,Anggaran
teman anak pas kasih mbg makan buah malah kasih anak akhir sama anak bawa pulang rumah,Kualitas Pangan
lahh orang siswa mbg makan mbg,Politik
top mbg,Lainnya
mbg masalah,Kualitas Pangan
pp tanya gaji sppi ahli gizi ma akuntan mbg berapa,Lainnya
apa mbg enak masakan ku semua lauk handmade sosis,Kualitas Pangan
dasar data berita kini 2024-2025 insiden racun anak indonesia khusus program mbg rata 2-3 kasus per hari lapor besar total 700 kasus 10 bulan namun mungkin underreported persentase kecil 82 9 juta terima,Kualitas Pangan
mbg banyak jumlah daerah ada nunggu milu ,Distribusi
min up bangun mbg bongkar tembok rumah tampa ijin,Tata Kelola
program makan gizi gratis mbg bantu penuh gizi anak sekolah tingkat semangat ajar dorong hadir siswa dukung semua pihak penting program tepat sasar dampak nyata masa depan indonesia,Sasaran Penerima
mbg sekolah jepang,Lainnya
banyak negara aku hasil mbg ,Lainnya
kritisi perintah  kalah kalah anak racun mbg  syukur,Politik
