full_text,label
pak  menteri langsung copot saja pak mutu layak kritisi netizen sedang fokus awal tulis sejarah mbg uu tni jangan ganggu urus istri menteri mirip gin,Politik
program makan gizi gratis pasti anak indonesia tumbuh sehat cerdas siap saing,Sasaran Penerima
klaim kasus racun 0 005 jadi korban 50 nyawa ancam per 1 juta terima mbg jika target 20 juta belum 17 8 25 siap 100 nyawa taruh,Kualitas Pangan
pl bagi mbg aneh,Lainnya
menu mbg hadir makan sehat aman anak ajar hambat,Kualitas Pangan
buat mbg bang biar kuat,Sasaran Penerima
stop mbg alih anggar 250t buat sekolah kualitas,Sasaran Penerima
waktu awal2 mbg baru mulai pernah komen nih kaya gin apk kandang nya buzzer buset langsung serang bilang sistem kaya kurang efektif,Tata Kelola
realita daerah2 1 jalan mbg punya triliun mencret jalan ambles budgetnya minim,Anggaran
rantang hidang mbg impor jadi polemik jumlah dapur mbg pilih produk lokal lebih higenis mudah bersih,Distribusi
bayangin prabowo legenda nika one piece sosok legendaris muncul buat bebas rakyat tirani amp ngerusak masa depan bangsa janji doang mbg mirip nika nyebar cahaya rakyat prabowo mao pastiin anak indonesia makan ckp sehat amp sjd generasi kuat,Politik
program siap banget kaji ulang murid paud tiap bekal makan istilah selalu 4 sehat 5 sempurna sama mama sekarang paud mbg anak jadi jarang makan malah kemarin utuh sekali makan sama sekali,Kualitas Pangan
pengaruh bijak kontroversial perintah ekonomi indonesia cukup besar utama bawah prabowo bijak potong anggar program makan gizi gratis revisi uu tni sebab protes massal turun ihsg hingga 7 outflow investor,Politik
pribadi tuju mbg berapa triliun dana habis buat mbg ini hasil apa dana mau ditmbh ratus triliun program ekonomi ri nyungsep coba dana sebut alokasikn buat kakak sbgi modal usaha,Anggaran
seruu mbg duit bool,Lainnya
paham khawatir soal korupsi dasar data icw program mbg memang kritik tata kelola buruk duga gelap kdmp baru luncur butuh awas ketat tuduh konspirasi perlu bukti kuat bukan spekulasi dorong transparansi,Politik
argumen benar bang masalah indonesia laksana bener duit pas2an jadi ladang korupsi pula turut lebih penting sertifikasi guru naikin gaji guru harus mbg sekolah2 pelosok bukan semua sekolah seindo,Tata Kelola
mana rata lagi sekolah sekarang rasa mbg jadi mending yu stop ganti,Distribusi
sekali apa yakk mbg,Lainnya
fats 2025 dukung program mbg sedia protein hewani,Kualitas Pangan
tiap loker mbg lewat grup wa begidik takut banget gimana pertanggungjawabannya,Tata Kelola
tinggi angka keras jadi alarm perintah tetap kirim aparat militer papua bahkan sampi masuk ruang sipil lewat mbg food estate kalau presiden prabowo serius selesai konflik papua dekat geser,Politik
mbg bantu tingkat ekonomi masyarakat lokal,Ekonomi
keren sih ide seram kalau benar dijalanin negara kasih makan bukan buka layan antar lanjut mbg anggar ketat amp masuk akal,Anggaran
brazil racun mbg ngga,Kualitas Pangan
masyarakat kurang mampu jadi kerja mbg proyek mbg bayar macet apa makin tahan lapar masyarakat bawah,Tata Kelola
terima kasih tag grok dasar data bpom lapor media bbc tempo jakarta post hingga juli 2025 19 kasus racun mbg indonesia korban gt 1 800 siswa sebab utama kontaminasi bakteri e coli salmonella akibat higienitas buruk amp simpan tak,Kualitas Pangan
jokowi banyak proyek mercusuar produktif potensi mangkrak prabowo banyak proyek ambisius sistem jelas potensi mangkrak mbg sulit sistem operasional lebih baik lapang kerja keluarga konsumsi makan gizi,Tata Kelola
ketika kampanye gemoy oke gas oke gas blunder nya menteri janji lapang kerja 19 jt mbg masalah buat hidup makin susah,Politik
jangan lupa total anggar didik 750an t besar 200an t buat mbg ges,Anggaran
padahal mbg sekali makan porsi 10ribu arti kalau hari makan mbg 3x dianggepnya miskin terus bayar listrik air ongkos kendara hitung,Sasaran Penerima
benar sri kasih kode dulu waktu pilpres jangan pilih pimpin gampang dikilik2 mudah marah  prabowo  pilih rasional  sering bilang rasional pidato adalag anis berat cari duit cuma buat mbg ng gaji buzzer geng solo bagi2 jabat dll,Politik
mbg bagus sih,Lainnya
siswa sman 1 cigugur memporak porandakan wadah mbg,Kualitas Pangan
poin benar buat boncos kan lama perintah sendiri bangun psn benar perlu2 banget tambah sekarang mbg danantara dll olah salah rakyat pick a struggle lah,Anggaran
nah bun kadang kalau makan kena sangsi orang mbg nya anak,Kualitas Pangan
335t buat mbg faak kacau bangeet didik apa fokus kasih makan perut anjir tolol banget kamu,Anggaran
ransum mbg bawa pulang biar anak makan bekal rumah masak mama,Tata Kelola
timses wowo fufufafa done sebar kampanye mbg,Politik
tempat mbg stop lama libur sekolah lanjut pas awal tahun ajar,Distribusi
golf tetap kena pajak nder problem perintah bu bola basket voli padel kan olahraga kelas tengah ya inti mau cari sempat buat duit lini mana imbas program mbg ikn boncos utang indonesia sekarang 8rb t,Anggaran
aowkwk dana guru tinggi potong mbg joget dulu omke gas omke gas,Anggaran
sepakat program mbg perlu lebih ketat awas masuk siapa dapat tender program  jadi kurang alam olah makan banyak jadi keracuanan mungkin kurang alam orang program ini,Tata Kelola
presiden tahap jalan perintah ikn amp ramping k l amp program kurang efektif efisien strategik amp mubazir layan masyarakat mbg amp jalan ekonomi masyarakat sesuai tuju negara uud ri 1945 jiwa pancasila,Politik
gampang batal program mbg alih anggar ingin sebut prioritas ajar jalur prestasi,Anggaran
lihat makan program mbg banyak buang sangat sayang alangkah baik bijak lebih diperioritaskan daerah pencil bukan kota2 besar,Politik
jangan protes kalau anggota dewan gede rakyat mau bodoh cukup bansos mbg puas,Politik
si bloon pakai tanya sekolah rakyat kamu sama mbg lah,Anggaran
hmm mendem kenapa belatung ikut mbg,Kualitas Pangan
asal bicara cari tahu dulu jalan program ikan makan hari biasa bawa pulang rumah lanjut mbg,Distribusi
nih mau ajak mbg ya makan sama gratis,Lainnya
mbg sini kata adik enak cuma katsu nya,Kualitas Pangan
kamis 7 agustus 2025 pukul 10 21 wib bhabinkamtibmas kel cipondoh brigadir agus m monitoring giat bagi makan gizi gratis mbg 355 siswa i smks teknologi informatika ypml tangerang giat rupa bagi program cooling system cipta,Distribusi
contoh hasil mbg,Kualitas Pangan
wkwk jujur guru muak sama mbg ini jam ajar potong sekarang suruh jadi kang cicip makan,Kualitas Pangan
campur racun campur belatung mbg nya,Kualitas Pangan
dih mbg full racun,Kualitas Pangan
eh sad truth nya siswa kritik mbg kasih bahkan foto boleh sisa juga padahal kalau spmi sisa makan nya jadi gambar daya terima menu sebut,Tata Kelola
semua efisiensi anggar nyekek pemda kemudian turun nyekek rakyat  utang negara jatuh tempo mbg beban anggar harus tiada kemarin rekrut sppi besar buat program mbg makin berat mau gimana negeri,Anggaran
mah mbg  makan racun gratis,Kualitas Pangan
usah pakai mbg kali bu kalau buat hitung kenal makan,Politik
badan gizi nasional gandeng umkm sukses program makan gizi gratis,Ekonomi
jabat prabowo kalau bikin statement kayak pandang enteng nasib rakyat ya bukan evaluasi mbg layak terus cara sekarang orang sistem ubah mgkin nunggu anak2 tular bakteri dulu baru bahkan tinggal baru buru2 evaluasi,Kualitas Pangan
analisa sederhana mbg  apbn china 2937 8 miliar dollar apbn 102 09 miliar dollar terima mbg china 37 juta anak 291 juta anak sekolah real kelas miskin fokus wilayah pencil indikasi kurang gizi kalau beda penting politis nya dapat,Sasaran Penerima
betul coba viral bicara mbg tegur wkwkw,Lainnya
liat tragedi pesta rakyat kdm benar miris lihat kan kualitas rakyat indo kayak apa makanya bilang kemarin taktik bikin program makan gratis langsung menang memang tuju cuma mau menang ambil kuasa bukan baik sistem,Politik
terus hasil brazil buat ngurangin stunting mbg  wkwkkwk,Sasaran Penerima
kaya makan beli sendiri pakai duit negara lah mbg kata makan gizi anggar siswa nya minim minim minim ,Politik
stop mbg,Lainnya
uang makan ganti mbg biar rasa lidah rakyat,Anggaran
pramusaji mbg buka besar besar ,Lainnya
piye mbak stella ajar apa kasus2 racun mbg mampu apa mau tingkat mampu tahan hidup,Kualitas Pangan
mbg hari,Lainnya
berapa biaya mbg sekarang dua program sebut worth it,Anggaran
pak bantu  bangun mbg mas  protes sana sini tindak lanjut  lokasi purbalingga jateng,Tata Kelola
termul kader psi dn dukung wowo gibran mana paham ginian cuma ngerti mbg dn joged2 kayak orang waras,Politik
biar apa biar biur btw mbg semua daerah yaa pernah dengar cerita sepupu smp mbg,Distribusi
kdm ahok punya soludi sama kait program mbg,Tata Kelola
apabila murid guru hadir lama masa libur sekolah program mbg lanjut kendati tidak bangun fokus program mbg ibu hamil susu anak balita lanjut mbg keren,Distribusi
makan gizi gratis wilayah kodim 1430 konut baca lengkap,Distribusi
program benar bagus mbg bagus biasa eksekusi lapang nol besar rencana benar2 matang,Tata Kelola
sorry bro indo sibuk ngurusin mbg sama ijazah orang penting,Politik
jadi perintah kok bisa bikin rakyat susah  contoh  dagang sekolah  jam masuk anak maju jadi jam 6 30 pagi  ehh siang anak2 kasi mbg  akhir dagang makan seko laba,Ekonomi
amina iow daga beug tiow,Lainnya
didik pisah mbg 700an trilliun mbg sendiri 335 triliun jadi pure didik cuma tengah aja,Anggaran
waahh tahu program mbg 2003 deh biar pintar bahasa inggris sesal pintar bahasa inggris gara2 mbg,Politik
tahi emang waktu revolusi didik jadi prioritas malah samping mbg danantara koperasi merah putih ngentod,Anggaran
kalau menyelsesaikn kasus ijazah palsu jadi program positif prabowo blok bahkan nilainy lebih tinggi program makan gratis ,Politik
kan satu per satu baru mbg nomor 1 gilir nomor 2-10,Politik
ratus siswa kulon progo racun duga akibat menu mbg pemkab tetap jadi luar biasa alas,Kualitas Pangan
mbg lumbung,Lainnya
mbg jadi ajang racun rakyat konoha sukses tikus negara tiongkok bebas curi wilayah ri tambang emas puluh ribu trilyun rupiah per tahun lama puluh tahun akhir terus terus hingga akhir jaman,Politik
program mbg mu banyak bocor,Tata Kelola
anak teman kerja smp kalau mbg kaga makan bawa pulang buat campur makan rumah ga rasa cenah,Kualitas Pangan
bhabinkamtibmas kel ppi aipda dwi sutanto sambang sdn poris plawad 9 wilayah kel ppi kec cipondoh kota tangerang giat tuju koordinasi kait program makan gizi gratis hingga jadwal laksana konfirmasi,Distribusi
jadi beban berat apbn nyata depan mata mbg nguras apbn benar masalah racun seringkali jadi perlu malu malu henti program paling beban apbn,Anggaran
bpjs tidur tunjang hadiah pahit hut ri ke-80 anggota dewan pamer income 100 juta bulan rakyat cukup bansos mbg tetap bodoh bodoh politikus,Lainnya
nih cara pikir gimana ya negara digitalisasi it masuk rapbn sedang mbg jalan terus urgensi mbg nih apasih sebenernya heran,Kualitas Pangan
presiden prabowo komitmen bangun masa depan anak indonesia lewat didik adil kualitas tingkat tunjang guru sekolah unggul garuda pp tunas makan gizi gratis revitalisasi amp digitalisasi sekolah 100 titik sekolah rakyat didik vokasi terpsat,Politik
program makan gizi gratis mbg tuai sorot tajam ratus siswa bagai daerah alami racun massal usai santap makan program ini kupang cianjur hingga bogor gejala mual muntah hingga pingsan lapor jadi,Kualitas Pangan
nih bisa bikin cerdas matematika hari tiga mbg liar ulat sayur anak2 sma favorite junior saya,Lainnya
240 t banyak laku uang besar atas anggur mbg program tak tepat atas masalah,Anggaran
da nexul wax rek mais nafekks rek moy sonko,Lainnya
masyarakat miskin d tiap daerah tuh beda2 ya biasa ada jorok amp bersih sekarang kalau kamu memang mau buat program mbg pastiin tangan kamu bersih bukan mlh nyomotin duit rakyat terus victim blaming nyalahin rakyat miskin tolol,Tata Kelola
hari capai bgtt sangat happy syukur pertama ikut liturgi ilahi orthie russia ketemu uskup orthodoks russia jakarta lanjut makan gizi gratis alias makan besar terus sore misa servatius kampung sawah,Lainnya
benar memang pepatah kalau main sama tuk parfum jadi wangi kalau banyak main sama rezim fufufafa jadi orang kurang mbg gitu,Politik
padahal rasa mbg lulus,Lainnya
mbg basi kak,Kualitas Pangan
waduhh mbg nder sidewalk,Lainnya
miss arinn miss arinn mirip tahu program mbg tuh buat kasih makan ego jabat,Politik
video serap dana mbg minim baru rp 5 t rp 71 t,Anggaran
bagaimana mau merdeka bodoh  anggar didik lebih kecil anggar mbg banyak tai,Anggaran
krisis lahir korsel  kasih bantu lahir bayi wakanda  mbg  ngata2in feminist pajak naik,Politik
mbg paling 1 porsi 20-30rb makan buat menteri 1 porsi 171 ngidupin negara orang tua terima mbg lewat pajak terus ikut bayar hutang negara sang terima mbg mungkin hingga anak cucu baru lunas utang negara,Anggaran
coba rapat dpr jajar pakai menu mbg memang mbg banget berani,Kualitas Pangan
mending stop aja mubazir mbg makan gizi desokalah kampung makan makan rumah lebih enak,Kualitas Pangan
kpk hari  bukan tugas anda kalau mau endus tuh mbg nilai triliyunan katena potensi korupsi besar,Politik
ingat bukan salah mbg cerna si anak masalah,Kualitas Pangan
guna mbg sekolah rakyat makan gizi jadi pintar pintar kelak mereka basmi jabat korup hari ini,Sasaran Penerima
kamu apaansi paling anggota dewan kamu kasih mbg senin jumat gaakan mau kan kan jujur,Kualitas Pangan
maaf perintah sedang sibuk mbg sekolah rakyat,Politik
tenang saja mbg kok hehehe bgtu ad d pikir wowo dn dukung,Politik
sini mbg sih pernah bagi paket makan lansia nasi paha sop pas mbah hidup makan layak sepupu program stunting dapetnya sembako telur beras daging,Distribusi
bill gates ngomel2 media dana sehat cut crazy rich2 indonesia dana apbn cut semua mbg protes y protes beberapa media eg ferry irwandi ,Anggaran
pesan nya adalah prabowo ingin program besar nya bekas ingat masyarakat contoh mbg koperasi desa itu walaupun instrumen program sebut siap jalan prabowo mau tetap luncur publik,Politik
event nobar sekaian mbg bioskop jadi dateng pan tahu sendiri kalau gratis serbu,Lainnya
lha nopo go nampan nek mbg ne ciki2 nan,Kualitas Pangan
pikir anggar mbg luar anggar didik tetap 20 apbn,Anggaran
tunggu 2045 anak2 hasil mbg tinggi 180 cm tubuh kekar six packs iq 300,Distribusi
kata mah ya mbg stop zayang sekali makan banyak ekbuang bukan selera murid,Kualitas Pangan
sebut bijak presiden pro rakyat  temu  mbg  racun efisiensi  mobil dinas jabat dana nya naik bagi2 jabat perlu artis danantara  ladang korupsi kurang transparansi apalgi lain kata,Politik
program makan gizi gratis mbg langkah nyata perintah bangun kualitas sumber daya manusia sejak dini pasti anak sekolah dapat asupan gizi cukup mbg jadi fondasi penting cetak generasi sehat cerdas daya saing,Sasaran Penerima
mbg sukses taun sekali makan gratis berantas korupsi sukses ribu koruptor tangkap 11 00 t uang sita tega hukum pandang bulu tidakada rangkap2 jabat miskin jadi 194 juta versi bank dunia anggur turun kat bps walo phk dimana2,Politik
dasco minta insiden racun mbg tak ulang,Kualitas Pangan
tuju rugi rp 551 t tahun limbah mbg memang besar transfer tunai ibu minimal itu butuh verifikasi guna dana tetap gizi anak perintah evaluasi moga baik,Kualitas Pangan
stop mbg,Lainnya
memang paham mbg budgetnya dikit terus kelola malah open rekrutmen tara asn segala latih militer serius mahal biaya kalau orang swasta lebih pilih lemparin subkon ngawas orang tan kemenkes paham gizi korupsi cuma masif,Tata Kelola
mekanisme nya sepakat dulu bang murid sekolah guru kalau tetap saji biasa lanjut mbg,Distribusi
jujur lulus ahli gizi waktu mau naruh loker mbg hati nurani gelisah banget plus teman banyak naruh cari kerja sekarang gampang meski skill bidang digital moga allah kasih jalan lain buat ikut program ini,Tata Kelola
alih dana mbg beri makan gratis lebih penting tambah jumlah orang didik,Anggaran
makan sumber energi energi daya upaya hpp gabah tinggi tani sejahtera optimasi ekonomi rakyat pangan mudah makan gizi gratis makan gizi gratis bukan program didik akar ekonomi tani rakyat bawah moga bgt,Ekonomi
hahahahhahaa mbg 10 ton beras danantara ngurus obat gaza pelit buat rakyat,Anggaran
anak2 lah oii memang kamu pikir guru smua lanjut mbg,Sasaran Penerima
berkat mbg,Politik
ikhlas bila mbg terus pak tuntut janji kampanye,Politik
sama mbg proyek gagal rugi negara amp bikin rakyat racun terus si owi sama wowo dikasusin gt,Anggaran
oh sekolah rakyat makan mbg kah kok enak,Kualitas Pangan
bas siswa sd bandung alami racun konsumsi makan gizi gratis mbg kepsek minta evaluasi kualitas makan saji via,Kualitas Pangan
jelas sukses program mbg pihak terus upaya laku sosialisasi daya laku usaha mikro kecil tengah umkm daerah tempat laksana program sebut aksi daya ekonomi lokal lanjut mbg keren,Ekonomi
uya kuya harap program makan gizi gratis segera rata jakarta selatan,Distribusi
tolong mbg sama ana jarang sangat makan bawa pulang mas utuh,Kualitas Pangan
cegah stunting sejak dini wabup hanies launching program makan gizi gratis ibu hamil susu balita,Sasaran Penerima
mantap nul hoax ijasah gagal hoax adu domba sibiru gagal sekarang ganti pakai mbg,Politik
sekarang liat budget tni seluruh bukan budget buat procurement doang sama budget mbg koperasi merah putih liat gede mana balik sini bilang perintah benar fokus belanja kamu asumsi enggak,Anggaran
mingdep mbg gue dude i refuse to eat that  kasih orang rumah aja biarin abang racun,Kualitas Pangan
masak orang racun mbg sebab biasa makan enak aya aya wae kalau ngomong,Kualitas Pangan
mbg adik nya basi anjriitt,Kualitas Pangan
suka makan mbg mereka doyan makan uang r,Lainnya
jujur sepupu ceritain mbg huek huek,Kualitas Pangan
mbg makan racun gratis bukti racun mbg tampar keras kritik humor mbg,Kualitas Pangan
rendah sdm akibat rendah pola tata kelola perintah anggar dimksimlkan rakyat kismin judul mbg praktek bagi fee proyek memang enak duit korupsi jamaah itu gak kerja jatah itu br mbg blm proyek lain,Tata Kelola
day 3 mbg menu nya sama ky d1,Kualitas Pangan
banyak sekali bgtu sekolah2 desa banyak isi kelas tengah bawah mbg akses susah ganti selenggara tawar sekolah2 elit kota isi kelas atas  penting ka program jalan,Distribusi
ogah paling kalian untung mbg noh baik standar gizi bumil n bayi buat cegah stunting perintah buta padahal mata banyak,Sasaran Penerima
mbg komitmen perintah penuh gizi anak bangsa,Sasaran Penerima
makan gizi gratis dek,Lainnya
makan gizi gratis tuk generasi bangsa,Sasaran Penerima
gong hari teman kerja baru tahu kalau kasus racun gara-gara program mbg of course they 02 voters kok se-ignorance ini,Kualitas Pangan
bilang makan enak mbg hmm,Kualitas Pangan
program mbg baik gizi anak bangsa,Sasaran Penerima
buka apa ini dapur mbg moga bayar lancar deh,Kualitas Pangan
ikn mbg,Lainnya
stop mbg lah,Politik
1 putus buat stop gantung teman pas kuliah akhir lulus cepet 2 putus buat ajar statistik data analyst otodidak akh jadi data analyst staff disakitin cewek karir atas cowok wkwkwk staff mbg cowknya sekarang,Lainnya
betul fakta kalau makan gizi gratis jadi program sukses bahkan jadi contoh buat negara lain cuma propaganda,Politik
presiden punya yakin mbg mampu buat putar uang bawah jadi lebih baik tunggu depan,Ekonomi
mbg buat anak sekolah racun bagaimana rencana mbg buat balita kalau benar laksana,Kualitas Pangan
yaelah grok mbg komposisi kek burger cuma bentuk burger  tambah potong buah drmana gijinya,Kualitas Pangan
badan gizi nasional mbg ,Lainnya
susu ultra plain 125 ml kosong dimana2 nyata threads blg terus komen2nya bilang semua stock dihabisin buat mbg ,Distribusi
12ribh nih mbg contoh lah,Anggaran
kak terima mbg seko lauk mau tahu gak sempol sama bakwan terus sayur buncis buah pepaya sering skrg awal mah ayam daging telor pernah sekali makan sempolnya paitt jadi trauma,Kualitas Pangan
semua kerja rezim alutsista kena serang padahal mbg laksana masalah loh serang bareng warga peduli warga mau warga mati bunuh militer asing tahan negara lemah,Politik
padahal konsep mbg negara2 tuh pakai konsep cafetaria loh entah bangun ambil konsep mbg darimana pakai catering gin,Tata Kelola
kaya rata aja sdku kedapetan tuh mbg sekarang wkwk,Distribusi
mngkin maksud beliau 290rb kerja dapur mbg itu umr gratis lagi ngwerii,Politik
program makan gizi gratis,Lainnya
masalah anak mbg sisa makan habis 60 masalah anggota dpr sama kasih snack habis,Kualitas Pangan
makan gizi gratis generasi sehat cerdas sman 1 padang bojonegoro jadi salah satu lokasi laksana program makan gizi gratis mbg bagi program prioritas presiden prabowo subianto tingkat kualitas sumber daya manusia,Sasaran Penerima
dpr harap program mbg jadi langkah nyata bangun generasi emas,Sasaran Penerima
angaran makan menteri giat rp 171 00 porsi angaran makan gizi gratis rp 8 00 porsi,Anggaran
pantas negara luar antri pengn ajar mbg kita saking luar biasa kali ya,Kualitas Pangan
kalau mbg terus jalan masa depan anak indonesia makin cerah,Sasaran Penerima
pas kritik mbg kemarin kencang bawa2 realita lapang,Politik
positif thinking antar door to door sama tugas mbg nya hehe,Distribusi
dukung giat mbg babinsa koramil 05 waingapu kawal laksana mbg,Tata Kelola
arti mbg luas kalau sak malesia singapore yak,Distribusi
niat baik tolong sama manusia mulia pak mohon realistis pak msyt miskin tinggi sekali pak program mbg banyak racun makan makan sangat bawah standard makan 4 sehat 5 sempurna sengkarut pajak mulai cekik,Politik
bayangin anggar bengkak cuma buat mbg efektif engga tambah sama buzzer dukung mbg lanjut mbg mbah kamu meriang,Anggaran
baik menu mbg mulai guna makan seluruh jabat tinggi eksekutif yudikatif legislatif lumayan kurang defisit anggar,Anggaran
tanggulang duga tipu wali kota solo respati bakal bentuk tim khusus cepat program makan gizi gratis -,Tata Kelola
kan kalau impor bakal cuan peduli mau rakyat indonesia racun apmaki sebut ompreng mbg kualitas rendah pakai bahan mudah karat,Kualitas Pangan
bang mbg cukup propinsi anak anak kurang gizi saja kalau kota usah lah atau pilah pilah sekolah terimakasih,Distribusi
jadi ingat ponakan kemarin cerita pertama kali mbg terus bicara dih tempe oreknya aneh bau enak  bagaimana kalau bau busuk coba pls stop korbanin anak anak,Kualitas Pangan
ayo gais up kasus bunting podcast jilat rezim tengah berita apa heboh mulai vonis tom lembong mbg pangkas lagi 19 negosiasi ngejual negara mamarika lalu kamu ribut pusing artis bunting luar nikah pantes pimpin bahlel wkwkwk,Anggaran
menu mbg hari allah mending paket gepreknya mba kantin,Kualitas Pangan
mbg hari tambah natrium biarin biar pusing,Kualitas Pangan
iya dek iya btw mbg belatung nya makan ,Kualitas Pangan
program mbg padang jangkau 9 316 terima manfaat tiga camat,Sasaran Penerima
point 3 seperti jelas dana mbg 223 6 asal dana program didik makanya d program didik tulis mbg lagi,Anggaran
justru biasa makan enak kamu kasi mbg perut sultan berontak,Kualitas Pangan
prabowo anggar rp335 triliun laksana program makan gizi gratis mbg rencana target 82 9 juta orang anggar naik kali lipat banding tahun 2025 rp171 triliun,Anggaran
mau tertawa len kayaak se proper menyiapkaan dapur nya gmna kok ngeracunin mana makan gratis kadang tepat sasar banyaak sangat dana keluar perkara mbg,Kualitas Pangan
mbg sejak awal masalah selenggara,Tata Kelola
program mbg jadi nyata upaya kuat daya beli sekaligus sdm,Ekonomi
yth kapan kasus2 racun mbg rendahnyaa kualitas menu makan jadi ulang terus jangan alas bawah 1 masalah sangkut nyawa anak2 percaya rakyat program mbg,Kualitas Pangan
guru besar mikrobiologi pangan institut tani bogor ipb ratih dewanti hariyadi tegas perlu kendali aman seluruh rantai pasok pangan program makan gizi gratis mbg cegah kasus racun sumber ,Kualitas Pangan
stella kamu tahu apa mbg mie babi kantin sekolah kamu harga hampir 40 ribu,Lainnya
140 siswa kupang duga racun mbg pakar ungkap fakta,Kualitas Pangan
enak masakan mbg yakali ikan lele ukur 2 hari doang jus buah naga 1 4 plastik banyak air,Kualitas Pangan
meanwhile konoha anggar didik potong buat mbg makan bikin goblok,Anggaran
anggar gaji hakim naik anggar polisi naik anggar partai mau naik anggar mbg aju tambah kenapa kalau soal didik gratis kok jadi punya uang  urgent mana si anggar buat jabat sama didik rakyat,Anggaran
saran mustahil ada tp ada hasil program mbg sebut saran tiap sekolah punya dapur program mbg khawatir racun lebih jauh,Tata Kelola
siswa sd smp sragen racun mbg sppg kena sanksi,Kualitas Pangan
kinanty0 ya logis nutrisi tingkat konsentrasi prestasi ajar dasar studi global namun klaim naik 8 bulan mbg dukung data publik independen mungkin dasar lapor awal perlu teliti lebih lanjut verifikasi,Sasaran Penerima
sekolah kalian mbg sekolah tuh ampe lulus sekarang ,Distribusi
program makan gizi gratis serap dana rp 8 2 triliun,Anggaran
mantab memang mbg,Lainnya
reaksi presiden prabowo tagih soal mbg presiden akhir minta cepat capai target 20 juta terima manfaat mbg capai akhir agustus 2025 harap bulan desember 2025 capai 82 9 juta terima manfaat mbg mantab,Sasaran Penerima
badan gizi minta tambah rp 118 triliun makan gizi gratis 2026,Anggaran
kan mbg jadi wajar balik jam 5 ,Lainnya
tunggu korban jiwa baru program mbg stop,Kualitas Pangan
lah banyak kok bejalan baik do akan depan kasus racun lanjut mbg,Kualitas Pangan
stngah anggar didik masuk mbg  kenyang perut lebih utama dripada cerdas bangsa seko sharusnya tuntut anak cerdas bukan perut kenyang,Anggaran
tetap semangat kawand mungkin rejekimu mbg,Lainnya
satu  overcooked visual nomor satu anak selera makan kalau lapor mbg lama visual gugah anak malas makan mending kantin beli cik es marimas,Kualitas Pangan
prioritas nasional 1 mbg basi 2 gaji dpr 3 dapat pemda lewat naik pbb 4 gaji kepala bumn 5 operasional koperasi merah putih,Anggaran
hukum zakat qs at-taubah ayat 60 perintah ngotot guna dana zakat mbg sama mengutak-atik al-qur an ini arti hina dusta hukum kafir ,Anggaran
rp33 triliun mbg hasil talang teles semua basah tak segar anggar didik 2026 capai rp757 8 triliun hampir 44 rp33 triliun alokasi mbg angka raksasa jadi jawab instan justru timbul tanda tanya,Anggaran
