full_text,label
pret sekolah mbg tetap anak jajan daan semua suka sama menu mbgnya,Sasaran Penerima
mbg bentuk garong duit negara tsm terstruktur-masif sistempik,Politik
pasal 34 ayat 1 undang dasar negara republik indonesia tahun 1945 amanat wajib negara pelihara fakir miskin anak lantar harus dana mbg salur,Sasaran Penerima
makan gizi gratis bikin masyarakat rasa diperhatiin bukan cuma dijanjiin,Sasaran Penerima
presiden ngotot paling kesal kalau mbg kritik jadi maju terus meski efektif,Politik
tetap makan nama mbg makan syukur gratis ,Kualitas Pangan
polsek teluk nibung monitoring makan gizi gratis sppg yayasan al muslimun nusantara kapias pulau buaya 2 402 siswa terima makan sehat lele goreng tumis labu tahu semur amp buah semangka,Distribusi
eiw efisiensi tahi nyusahin huwekk duit anjimg makan tuh mbg monyet,Anggaran
sejahtera tani naik mbg andal pangan lokal dorong prabowo,Ekonomi
presiden main sandiwara jelas mbg jalan baik silah cek daerah berapa persen sih program mbg jalan jangan pura2 sentak pak prsiden,Sasaran Penerima
betul mana farming jabat farming mbg terus buta data pulak halu bjir negara indon negara tingkat miskin nya tinggi bgt bro pakai segala omong sejahtera udahan bro baru lantik hancur negara,Politik
buat mbg lah anjayy,Lainnya
mbg  mulyono bos gemoy,Sasaran Penerima
menag nasaruddin umar sampai program makan gizi gratis mbg sekolah rakyat bentuk nyata lanjut semangat kemendekaan sejahtera bangsa,Politik
defisit anggar cara buang anggarann hari daerah mbg,Distribusi
perlu pimpin blusukan terima lapor abs asal bapak senang jangan gengsi contoh pa jokowi kdm lain suka interaksi rakyat kecil jangan pelosok bandung mbg lambat mulai,Distribusi
ide tunjuk si bagus ya mulai proklamasi pancasila its ok nah muncul makan gizi gratis entah jadi kesal lihat,Politik
mbg baik ruang kelas jauh lebih butuh bagi seragam kurang mampu punya kip,Anggaran
kok jadi masalah2 mbg sering amp berulang2 pak  amp apa kayak ajar program pam-tas era jalan lancar sukses masalah serius,Politik
chaos bareng mbg,Lainnya
mau kapan soal mbg kamu genjot terus,Anggaran
kasihan masyarakat pernah makan gizi mbg baru buat anak mereka cerdas orang menteri membully masyarakat nya sendiri,Politik
program makan gizi gratis bukan anak sekolah motor gerak ekonomi lokal libat tani ternak laku umkm sekitar manfaat rasa seluruh anak sehat rakyat sejahtera ekonomi indonesia makin kuat,Ekonomi
koruptor pasti dapat hukum sesuai buat lanjut mbg awas ketat optimis jauh lebih baik,Tata Kelola
baca jangan buru buru orang jelas jelas tempat makan mbg,Kualitas Pangan
guru suruh jadi tumbal mbg ,Kualitas Pangan
anggota koramil 13 kresek serka supatmo monitoring distribusi mbg siswa siswi sekolah wilayah cisoka yayasan al munawwir cendekia mulia cisoka desa cisoka camat cisoka kabupaten tangerang jumat 1 8 2025,Distribusi
tdp jsp gate keeper,Lainnya
mbg ig,Lainnya
bikin menu mbg salah satu program diet nih mayan lah murah loh ,Lainnya
buka kata lagi outlook rapbn 2026 anggar didik deal ya 44 757 8t anggar didik mbg 335t sedaapp sedaap skali mbg didik sendiri kebun binatang luas amp binatang anak sekolah gemuk,Anggaran
kata lain program mbg investasi jangka panjang masa depan indonesia fokus tingkat kualitas gizi kunci capai sdm unggul maju bangsa,Sasaran Penerima
awokawok sis cocok tanam amp ternak lom kalau guwe sih beli supermarket lagean suka mbg sorry ye sorry ye,Lainnya
evaluasi dampak mbg ajar makin buat gendut jabat kontraktor,Tata Kelola
mr yth apa laku cegah kasus racun massal akibat program makan gratis ulang,Kualitas Pangan
komunikasi politik bias optimisme lagi sulit euy punya pres detached from reality mahh telah bilang mbg sukses besar,Politik
rakyat d kasih mbg racun ff sama jenglot makan mewah2 an,Politik
saking murah biaya makan mbg buat banyak siswa racun makan,Kualitas Pangan
pernah baca komen balikin petrus biar anak anak manja tiktok tahu ga video nya apa video nya anak sekolah keluh kalau program mbg domisili enak kayak omg video se harmless itu memang mending punah manusia,Kualitas Pangan
tweet 4 bayar rantang hilang wajib ganti ulah bagi kepala daerah keluar nyata guru cicip mbg sebut serah siswa jadi guru jadi apa,Tata Kelola
mauk rate hari ospek day 1 sweruu poll samping frekuensi imod pembaiq shock njir nyata guest star nya om deddy then rate makan 6 10 hambar kayak mbg whopss,Kualitas Pangan
gila benar dana zakat program makan gratis guna perintah program makan gerat anggota dpr 1 hari rp 3 jt orang uang beras hampir rp 19 jt,Anggaran
mbg kan tuju kurang biaya beli beras keluarga punya anak usia sekolah,Ekonomi
mirip nunggu mbg,Sasaran Penerima
sekolah rakyat mbg program butuh anggar atas 350 triliun per tahun coba uang segitu genjot buat buka lahan kerja modernisasi tani,Anggaran
ade sekolah mulai mbg seperti percuma ade picky eater jadi tetap kudu bawa bekal sendiri,Distribusi
mbg is a solid alpha,Lainnya
siapa bubarin mbg,Lainnya
salah satu program prioritas utama presiden prabowo makan gizi gratis mbg tel anggar rp 121 triliun,Anggaran
adik baru mbg sekolah pap grup reaksi orangtua pertama kali cium dulu kalau bau usah makan,Kualitas Pangan
negara sanggup buat koperasi merah putih mbg sekolah rakyat usah buat baik negara fokus tingkat apbn lalu potensi sda sdm ada ngapain ngutang ngutang mau berapa hutang negara tanggung generasi indonesia,Anggaran
jujur sekolah tuh butuh smart tv anjir  guru smart tv ajar arghh perintah kok tolol sekali sih please stop kek ginian mbg sama tingkatin sejahtera guru susah ginian ngebuat p3k guru jadi paruh waktu dosa kamu,Anggaran
kejar target 20 juta terima manfaat mbg hingga hut ke-80 ri mungkin,Sasaran Penerima
mmyayangkan harus mbg prioritas murid memang bantu didaerah2 pencil dn data stunting tinggi dn mmberdayakan pangan lokal,Sasaran Penerima
semua miskin itu kamu rumah lebih better makan banding mbg,Kualitas Pangan
stop program mbg guna,Lainnya
mbg belatung terus sama racun biar makan anggar mbg matiknya dibelatungin kubur isi ular semua,Kualitas Pangan
program mbg pacu terus anak bangsa makin sehat kuat pasti,Sasaran Penerima
woy kocak bukan kamu ngehabisin uang didik buat mbg,Anggaran
mbg sangat mubazir bayang 1 orang anak sakit masuk sekolah makananya gmubazir gimana kalau seluruh indonesia 10 00 anak masuk program mbg pintu masuk korupsi lebih akal jual atas nama anak2,Anggaran
bukan masak mbg panggil dasar termul dungu total,Tata Kelola
stop mbg unfaedah,Politik
mbg nya racun kok dibanggain,Kualitas Pangan
kadang mikir beliau 2 pribadi sangat beda pidato janji kata kata sangat luar biasa tegas bagus ideal praktik lapang seringkali balik efisiensi kabinet gemuk tingkat didik gaji guru makan mbg,Kualitas Pangan
paling paham urus makan anak langsung orang tua bukan perintah negeri kalau bikin susah ngapain mudah cuan besar bisnis mbg,Tata Kelola
bilang mbg feeding ideal jauh itu negara tetap usaha feeding dalam meski laksana compang-camping bantu luar mirip 10 00 ton beras bukan tanda negara lebih peduli keluar bagi relasi sejarah posisi diplomatik,Politik
besok mbg kasih perintah biar racun terus mati massal deh yeayy,Politik
mbg kena kasus pondok inisal a karena santri mbg akhir lari rumah nasi asa opolosan sakit,Kualitas Pangan
makan gizi gratis dorong kualitas didik buka harap baru daerah pencil,Distribusi
netty kata minta orang siswa presiden prabowo subianto burger jadi menu program makan gizi gratis mbg tunjuk penting laku edukasi gizi lebih masif komprehensif lingkung sekolah keluarga,Kualitas Pangan
dasar data sumber katadata indef 2025 mitra mbg utama umkm tani nelayan kelola dapur lokal prioritas kelompok miskin kuintil 1-2 wilayah 3t cipta lapang kerja latar belakang ekonomi mayoritas,Ekonomi
mbg tetap kasih murid kok bilang mubazir sih lanjut mbg,Distribusi
20 juta makan gizi gratis anak indonesia,Sasaran Penerima
tambah proker2 perintah banyak makan biaya masuk akal mbg kopdes merah putih lumbung pangan dll jadi perlu efisiensi anggar beberapa tri kaya dana didik sehat diapgkas habis nutup proker,Anggaran
adekku pertama kali mbg sekolah gak enak sayur bau semangka kecut,Kualitas Pangan
duit negara cuma buat buat mbg mana punya output jelas balik modal cuma habis anggar,Anggaran
mbg mie ayam ,Lainnya
yah sayang dua punya sempat buat bukti wilayah masing pernah pilih pimpin also debat lebih unggul topik argumen data oke bukan masalah solusi mbg,Politik
jangan nder pernah ditawarin lokernya gamau gaji liat hasil mbg nder bobrok masa kamu berani ngelamar kesitu,Distribusi
hahahaha temen2nya adik rasa sama kok masa makan gratis enak tiap hari neng buah adik bilang itu kalau sekarang sekolah paling bakal senang mbg ini jauh sih bangga janji kampanye sesuai,Sasaran Penerima
makanya kasih dana mbg orang tua masing2 siap cinta pikir betul2 didik gratis seperti saudara2 papua sampai ngotot mbg ,Anggaran
eits baca dulu guys naik budget mbg naik alias tambah budgetnya mbg sejahtera guru sama,Anggaran
lah mbg kan ada protes kok bijak selalu kritik bijak lebih baik ajarin orang cara cari makan dripada dar kasih makan,Politik
racun masal bongkar fakta 196 siswa guru jadi korban program makan gizi gratis golong sragen -,Kualitas Pangan
big problem pak prabowo ide gagas besar bagus in action laksana lumayan kacau ukur contoh mbg banyak indikasi korupsi mana pak prabowo terlalu percaya person to person buat proses sistem jelas,Tata Kelola
kata event prabowo makan mbg jir,Lainnya
bhima yudhistira kritik anggar makan gizi gratis rp335 t -,Anggaran
tweet 1 surat orang guru presiden selamat pagi pak prabowo bicara atas nama pribadi kabar mbg rekrut 290 00 tenaga kerja dana ambil 44 alokasi dana didik sumber 20 apbn,Tata Kelola
perintah diam juli 2025 luncur 3 program prioritas sekolah rakyat didik gratis asrama anak miskin ekstrem cek sehat gratis sekolah daya sosial ekonomi program makan gizi gratis koperasi desa hilir cipta,Politik
my mbg nyamm,Lainnya
langkah pertama hapus mbg,Politik
ibu kota diitung eh mbg laku seluruh indonesia daerah tentu sih,Distribusi
lma papua barat daya dukung program mbg,Politik
he he jelas tepar sasar mbg d kota besar mbok d sekolah pelosok banyak makan nya kurang jatah 10 k apa anak ku tak tanya ma nya enak jawab e hambar lauk sedikit,Distribusi
loh bangsa kuat hebat kan mulai anak anak tumbuh sehat dak cerdas peran mbg lanjut mbg,Sasaran Penerima
mbg bangsatt,Politik
jadi pasok mbg supplier ikan naik kelas berkat kur bri,Ekonomi
padahal bukan sekolah negeri punya kitchen sendiri sekali mbg sih aneh,Distribusi
mbg  makan ber-larva gratis,Kualitas Pangan
kemplu jan harus mbg diliburin sekaligus evaluasi ketat amp seluruh,Distribusi
bangsat besar butuh makan siang gratis rakyat susah ekonomi gt mbg solusi rakyat stunting anak gt mbg solusi rakyat kena phk gt mbg solusi rakyat jerat judol gt mbg solusi rakyat sekolah gt mbg solusi mbg solusi buat negara besar,Politik
kata stella mbg tingkat mampu siswa matematika - bahasa inggris,Lainnya
indonesia emas 2045 tak capai anak sehat kuat hari ini mbg jadi kunci utama,Sasaran Penerima
kata mah jangan sanjung program perintah abu anggar mbg mula 25k jadi 10k mana vendor banyak bayar lagi,Anggaran
pantes hari libur panjang tetap salur jatah mbg nya menu kurang bergisi nyata 7an yang auuww ah gelap ,Distribusi
mungkin tega kasih makan basi anak masalah tangan jadi mbg sekarang aman pokok lanjut mbg,Kualitas Pangan
bekas banyak bagi mbg makanya aneh angka segitu harus rata bagi semua,Distribusi
hahaha program sohib si jokodox musnah progam mbg tu manfaat bagus program sekolah gratis sehat gratis buka loker sebesar2nya mbg  mukidi bahlul gibran ,Politik
demo mana jahat ai raja lela pajak naik pesat dana didik pangkas ekstrim cuma mbg pernah berita bagus janji kampanye laksana bawah kalau bicara asbun doang bagai sebut,Anggaran
1 sekolah rakyat maksimal sd inpres tambah fasiltas amp kurikulum taraf sd swasta unggul lebih sentuh seluruh rakyat 2 mbg buat central kitchen permanen tiap camat pakai jangka panjang ahli gizi amp distribusi lebih mudah,Tata Kelola
fokus ajar jadi lebih gampang kalau program mbg support makan sehat tiap hari,Sasaran Penerima
dana bansos pakai perata program mbg sekolah 2 seluruh wilayah indonesia program presiden prabowo tingkat kualitas generasi terus investasi masa depan bangsa,Anggaran
mbg makan racun gratis,Kualitas Pangan
mbg gagal sr gagal daya beli turun isomu opo,Politik
coba mas wapres turun mbg langsung disekolah2 dadak kalau diberitahu mbg lihat bagus,Tata Kelola
mbg gaje,Lainnya
entah kapan sadar bangsa energi buang sia sia yahya zaini sikap usul tambah anggar besar rp 118 triliun aju badan gizi nasional bgn laksana program mbg 2026,Anggaran
semua waras sangat sayang tahu kan perintah keras kepala apa tetap lanjut mbg,Kualitas Pangan
daerah berapa kali ketemu belatung lauk then what does the b in mbg stand for belatung manies,Kualitas Pangan
makanya presiden prabowo subianto laku program makan gizi gratis harap kelak anak anak indonesia depan sehat pintar bodoh bodohin janji palsu gibran,Politik
yah padahal mau ngirimin mbg,Lainnya
makan gizi gratis makan racun gratis,Kualitas Pangan
bangkee mulai mbg ini makin beres niih negara,Lainnya
buat mbg cinta dongg,Politik
moga semua dapur mbg lancar distribusi maknyus kapolri,Distribusi
warga sukabumi milu kemarin menangin 02 dijogetin gemoy2 santap mbg,Politik
gubernur bengkulu helm hasan nyata kesiap provinsi jadi daerah aktif dukung arah bijak nasional proyek strategis nasional program makan gizi gratis mbg tahan pangan nasional,Politik
hasil jadi ta i tak sedikit racun luar biasa program mbg tuan presiden,Kualitas Pangan
tuju mulia penuh gizi anak kalau topang konsep rencana matang hasil gagal heroic lebih tuju uang mbg program sejahtera masyarakat logika sederhana rakyat sejahtera beli makan gizi ,Anggaran
guys mau bikin sebar racun mbg indonesia si kek mana zona merah zona kuning dll,Kualitas Pangan
ngerti dah duit pajak buat mbg doangg kahh untuk,Anggaran
sebut umkm jadi dapur mbg,Ekonomi
gimana rawan awas mbg orang baru lulus kuliah benar saran ahok mbg effective kalau libat ibu ibu siswa sebut buat dapur sekolah,Tata Kelola
gedeg sekali sekarang mulai sliweran mobil mbg mbg jelas itu mana waktu pp nglewatin kantor pula,Kualitas Pangan
gimana kalau konsumsi rapat jabat sama mirip mbg,Anggaran
ain mbg makan anjing,Kualitas Pangan
negara auto pilot pimpin sibuk sendiri urus mbg ikn danantara rakyat megap2 susah cari kerja sekarang jelas sangat solusi nya apa,Politik
wew kayak mbg lebih mungkin realisasi buat agenda satu bang tinggal tambah usul terima kalang mahasiswa biar kader komisariat tahu bagaimana ransum gizi ala bangun itu,Sasaran Penerima
kepala bangun dad hindayana sampai pihak minta kepala satu layan penuh gizi sppg pasti berapa kali minggu murid guru hadir sekolah lama masa libur sekolah lanjut mbg keren,Distribusi
selalu bilang negara butuh anggar besar kerja hura hura terus naikin gaji anggota dpr kerja jelas rakyat dipalakin pajak abis abis benar benar waras negara bangun negara nampak  fokus mbg ningkatin korban racun,Politik
program mbg memang punya niat baik atas stunting insiden racun massal lebih 2 00 korban sejak januari 2025 sumber bbc tempo cnn tunjuk gagal implementasi serius bubar evaluasi total amp ketat standar selamat program apa,Kualitas Pangan
download rangkum dokumentasi initiative mbg stunting sudah arah tepat,Lainnya
benar program mbg mulai tahap januari 2025 uji coba awal per juli 2025 jangkau gt 6 juta terima kurang miskin amp stunting apresiasi dunia bukti hasil konkret sumber 21 juli 2025 subyektif ya,Tata Kelola
pusing anjrit mending main roblox segala udang cemar radioaktif bayi tinggal klb campak bayi tinggal cacing camp bangsa swiss mbg stainless non food grade indikasi cemar minyak babi lard oil,Kualitas Pangan
nihayatul wafiroh desak aparat usut sedia mbg buntut ratus siswa ntt racun massal,Kualitas Pangan
segabut ladenin debat sama sedia vendor mbg terima kalau mbg beban by data mbg beban anggar negara capai 50 tahu kan mayoritas anggar negara duit rakyat pajak kalau pov rakyat mau duit cuma buat urus perut,Anggaran
mbg jelek paksa aja buat apa sih,Kualitas Pangan
mbg ganti mie instan ringan malah anak suka meski nol gizi,Kualitas Pangan
gampang mbg mu cuma nasi tentara seabreg terus lauk tempe orek cuil susu sama buah segecil,Kualitas Pangan
kalau tahu biasa si anak diwanti-wanti rumah sama orangtua kalau sekira mau makan mbg yaudah usah makan biasa bekal rumah biar dar ikut makan sama,Kualitas Pangan
berapa besar dampak ekonomi program mbg,Ekonomi
bangun jangan tutup mata dpr ri sebut laksana mbg tunjuk lalai serius,Tata Kelola
tuju rencana abal-abal ujung hancur kasus mbg temu belatung racun bagai daerah papua tuban dll sumber tempo detik 2025 namun baik awas ketat program potensial kurang stunting apa,Tata Kelola
anying mbg apa cok kok premium,Kualitas Pangan
program makan gizi gratis mbg gulir presiden prabowo  program unggul tuju tingkat kualitas sumber daya manusia lalu beri makan gizi siswa-siswi,Sasaran Penerima
pak elan abhijit banerjee buat paper buat evaluasi dampak mbg wkwkwkw,Lainnya
kamu sono sama tri tri kamu cobain makan mbg beracunn biasa gak,Kualitas Pangan
anggar ratus trilyun program mbg lebih baik guna buka terna sapi terna telur ayam kebun sayur mayur kota kabupaten hasil panen program mbg goblo k,Anggaran
opini thoollol riset tanpa beri program mbg orang ajar lewat ahli gizi gratis media online lu pikir menu mbg gizi semua  thoollol bain gin gadapet jatah jabat ,Kualitas Pangan
masyarakat tingkat tegas wamen isyana buka mukernas ipekb hut ke-18 ipekb senin 28 07 mulai makan gizi gratis sekolah rakyat layan cek sehat gratis kuat ekonomi lewat koperasi merah putih tahan pangan lalu,Politik
semua butuh makan bang butuh pokok manusia aneh suru setop padahal manfaat lanjut mbg,Sasaran Penerima
pahala mah kalau mbg nya palestina noh krisis baru cari pahala,Politik
ratus siswa ntt racun usai konsumsi makan gizi gratis,Kualitas Pangan
perhati sedikit hidup negara kuasa sejati hidup rakyat indonesia murni 100 juang sendiri apa arti bansos bsu mbg kalau rakyat akhir pajak naik bayar pajak pajak langsung potong,Politik
wala kamu tegur bilang awas mbg nya,Tata Kelola
kualitas mbg lihat prilaku korup,Politik
bekal makan minggu ini alhamdulilah gizi buat istri soal makan gizi gratis entah buat siapa,Lainnya
tokoh papua dukung mbg,Politik
mbg rupa program mampu bangkit ekonomi rakyat komprehensif,Ekonomi
tuju pakai sekali pak poling nya sangat wakil gereget lihat nyata seorg tri unfaedah ank2 racun mbg,Kualitas Pangan
aamin btw mbg jelek sekali anjing enak telor basi,Kualitas Pangan
ikut mau egx kapein nyuri smwa pangan mbg perintah walah akhir progamny ganti jadi didik gratis deh ,Lainnya
11 12 sama junjung gemoynya liat murid racun mbg cuma angka,Politik
produksi mbg higienis generasi emas indonesia,Kualitas Pangan
dengar banyak cerita mafia mbg daerah jawa barat parah,Tata Kelola
salur mbg ibu hamil ibu susu hingga balita tetap jalan mekanisme kirim rumah posyandu kelompok ibu hamil ibu susu anak balita lanjut kirim rumah posyandu masing-masing lanjut lanjut mbg,Distribusi
memang bisa dapur mbg bukan mitra memang ngatur karyawan mitra ya,Tata Kelola
cara pintar kuatin bangsa investasi makan gizi gratis lewat apbn 2026 anak indonesia tambah tangguh,Sasaran Penerima
pasti kualitas makan gizi gratis mbg tetap jaga perintah gandeng bagai menteri lembaga masuk kemenkes kemendikbud badan pom,Tata Kelola
bayangin kalau prabowo kasih mbg basi,Kualitas Pangan
omong kosong tingkat saldo orang bgn daerah tuh mbg perintah indonesia jadi bebal,Distribusi
mbg  makan belatung guys,Kualitas Pangan
lemas kaya anggar buat mbg,Anggaran
rakyat amp mahasiswa bangladesh lebih harga isi negeri ini mudah takluk sembako amp mbg,Politik
anda ai terap buat masak kontrol mbg masakan belatung masakan basi,Tata Kelola
ya berita henti cpns 2025 benar perintah buka ppk jagung kppu bgn fokus selesai casn 2024 sumber kompas kemenpan-rb alas thread - kabinet prabowo punya 48 menteri 56 wamen benar per setkab - anggar mbg rp71-121t benar,Anggaran
mbg sangat bantu tumbuh kembang masyarakat,Lainnya
kasihan pak dihianati bawah sendiri pelaku2 mbg malah tuai kecam sesuai ekspektasi,Tata Kelola
mbg lintah darat anggar besar pagi anggar apbd besar pertama kurang dsaat kwalitas makan buruk daerah,Politik
ah om sam kyak tahu sulap aja data orang miskin ilang drastis palagi cuma data mbg tinggal main sulap ilang,Sasaran Penerima
mbg hari soto kuah soto hanya alih rasa eneg protein,Kualitas Pangan
akuteh mau bikin thread mbg kamar keburu libur jadi weh  lanjut ya,Lainnya
naon sakola urang asa teu kabagian mbg mbg acan,Distribusi
paling bahas jauh2 mbg,Lainnya
makan gizi gratis malah jadi makan acum gratis ooh tolon,Kualitas Pangan
informasi nya dana apbd kritis potong duluan nutupi hutang mbg salah kalau bilang akar masalah pusat negara salah kelola semenjak perintah jokowi,Anggaran
tanya benar mau jalan sppg jalan mbg kalau jalan mbg cukup kelola serah sekolah masing2 benar masalah muncul program mbg lama justru sppg mulai makan basi racun menu tak,Tata Kelola
program rentan korupsi semua sama aja penting jangan mudah serah bangun bangsa lanjut mbg,Tata Kelola
enak sekali mbg,Kualitas Pangan
program mbg kalau bikin racun terus mending buat kasih makan tuyul lah biar usah kerja keras sangat rasa toleransi tuyul sama racun tuh tinggi gaakan mati juga,Kualitas Pangan
makin kesini makin peduli mutu didik mbg lebih penting mutu didik masuk kesejahteraanya padahal mutu didik hasil kualitas didik srimul tolak gaji guru amp dosen bayar negara bilang gelap,Anggaran
siap beri rakyat lemurian program makan gizi,Lainnya
kemarin ngeliat atchive sg tetangga masuk sspi latih megang senjata  dawg urus manajerial mbg latih militer sama megang senjata buat apa mana bukan lulus gizi ,Tata Kelola
50 t mbg,Anggaran
semua dipajakin kalau rakyat diurusin kasih fasilitas bagus sih masalah lah semua dipajakin buat apa coba buat mbg paling,Anggaran
ya tiada tender buka ada barang jasa publik masuk program makan gizi gratis potensi korupsi uu 31 199 timbul rugi negara kolusi icw ti indonesia sorot celah ini meski jabat klaim balik,Tata Kelola
ucap prabowo kata dapat lapor dapat 6 7 juta terima manfaat mbg,Sasaran Penerima
pelihara miskin lebih bagus politik makanya program mbg bukan didik baik,Politik
mbg husnul racun,Kualitas Pangan
bagaimana kalau dpr dukung putus perintah potong dapat anggota dpr mbg,Politik
blah blah,Lainnya
mampus mbg sukses kata wok woi wowok kata mbg sukses wok banyak negara mau ikut wok batung gin ikut kah mau makan kah catering bayar yaa makanya pakai bahan busuk belatung,Kualitas Pangan
drama mbg hari ini ma ayam keras dear tim mbg dong masak ayam diempukin sedikit ,Kualitas Pangan
puluh siswa kulon progo racun santap mbg 80 persen murid smpn 3 wates dampak,Kualitas Pangan
metriksnya pakai jumlah orang racun mbg,Politik
isu nampan program makan gizi gratis mbg ramai bahas duga kandung minyak babi buya yahya tegas semua bagi babi haram islam via,Kualitas Pangan
sayang sekali mbg bukan sasar tepat serap anggar sangat besar anggar besar banyak serap kerja,Anggaran
kan bocor gara gara program mbg kamu kek kakek,Anggaran
kata tii soal efisiensi anggar politik hukum mbg hingga perub via,Anggaran
program mbg tuju tingkat gizi anak lawan stunting kritik muncul kasus racun makan kurang transparansi anggar rp71t vendor bayar perintah bukan tolol butuh evaluasi ketat efektif saran libat awas independen,Tata Kelola
temu jadi ruang dialog strategis dukung efektivitas salur kelola anggar jumlah program prioritas daerah tunjang hasil guru program makan gizi gratis sekolah rakyat sekolah garuda amp kelola sekolah dinas,Anggaran
aktivitas2 ekonomi ikut olah sampah pangan pakan ternak warung makan kerja dapur mbg dapur operasi hampir 24 jam hari kali semua target 3500 dapur se indonesia 1 3 jumlah jalan baik industri pangan negara ini,Ekonomi
allah kasihan sekali guru sleman diy lebih parah lagi guru perintah cicip mbg siswa racun akhir guru racun,Kualitas Pangan
kalau libur mbg tetap jalan tanya sederhana nya makan siapa,Distribusi
coba wamennya ikut makan mbg,Politik
masyaallah puji perintah adil meski siswa libur sekarang gilir siswa tak kasat mata jatah mbg tenang sana adik adek bilang malaikat kalau ayam enak gede yaa minggu depan kasih lagi ,Distribusi
prabowo tinggal akuin dah kalau mbg program gagal food estate bandara kertajati koperasi merah putih ,Politik
anggar mbg 2025 puluh triliun rupiah banyak sekali kasus racun mbg daftar jumlah korban racun mbg dasar sumber verifikasi  nganjuk okt 2024  7 sukoharjo jan 2025  40 nunukan jan 2025  30 tebingtinggi feb 2025  8 empat lawang feb,Kualitas Pangan
mbg loh onok gizi e blas tak delok2,Kualitas Pangan
hai 203voltage janji 19 juta lapang kerja on progress agustus 2025 program makan gratis ciptain 290 ribu jobs anyar total jobs baru 3 6 juta awal taun iki anggur mudun dadi 4 76 meski pemuda isih dhuwur 16 awal masa jabat optimis,Ekonomi
mungkin dua kalau mbg wkwkwkwkwkw,Lainnya
iee subscription ganti makan gizi gratis,Lainnya
nah program mbg nih wkwk,Lainnya
langkah antisipasi racun mbg tuh bukti kalau perintah ajar alam,Kualitas Pangan
mbg deket rumah nyata bagi cuci piring pakai mesin manual,Tata Kelola
paham he he jk prtykn sekolah gratis dibbrp daerah kan mbg plus sekolah rkyt mulai,Sasaran Penerima
mbg dorong anak kenal pangan lokal sejak dini,Ekonomi
nyebut 50 trilyun mirip nyebut 50 juta ribu enteng banget bubarin wja program mbg cuma buat bancak umur hidup laku bikin bangkrut negara hutang tambah gunung,Anggaran
netanyahu  mbg  netanyahu muntaber,Lainnya
40 nya mbg sehat mesti kalau cukup anggar tunda dulu mbg kasihan desa banyak sekolah layak guru miskin bin kere bingung bagaimana mbg guna dana didik lebih baik tangkap rc sedot turbo hisap ribu t rampok,Anggaran
dapur mbg tutup dulu sementara benah  standard dapur alat beri tanggung jawab dapur  sppi  jamah makan certified suplier data quality iso kalau ada halal,Tata Kelola
terlalu mewah mbg,Lainnya
